Page ID,Page name,Disclaimer,Amount spent (USD)
104530258866956,Stop the Corporate Online Gambling Prop,"Coalition for Safe, Responsible Gaming, Sponsored by California Indian Tribes. Committee major funding from: Pechanga Band of Indians, Yocha Dehe Wintun Nation, Agua Caliente Band of Cahuilla Indians. Funding Details at www.fppc.ca.gov",133892
192448150001,Jeff Anderson & Associates,Jeffrey R Anderson PA,73230
123450447708791,Energy Upgrade California,California Public Utilities Commission,64976
10128918116,Gavin Newsom,NEWSOM FOR CALIFORNIA GOVERNOR 2022,55324
238142787549374,Teddy Kapur,Teddy Kapur for City Attorney 2022,42789
168496243781414,Mayor Giselle Hale,Giselle Hale for Assembly 2022,41856
108617051499061,Ándale Qué Esperas,AltaMed Health Services,41347
102851832441142,Vote Schubert for Attorney General,Peace Officers Research Association of California (PORAC) Statewide Independent Expenditure Committee.,39877
100113545962506,Californians for Solutions to Homelessness and Mental Health Support,"Californians for Solutions to Homelessness and Mental Health Support, a Coalition of Housing and Mental Health Experts, Concerned Taxpayers and Digital Sports Entertainment and Gaming Companies. Funding Details at www.fppc.ca.gov",38462
106575778297762,Yvonne Yiu for State Controller,Yvonne Yiu for State Controller 2022,36464
105308481683326,Nathan Hochman for Attorney General 2022,Nathan Hochman For Attorney General 2022,33784
106953981943902,No on Ventura Measures A and B,"Stop Measures A & B – A Coalition of Working Families for Jobs and Energy Independence, Supported by Energy Producers. Committee major funding from Aera Energy and Chevron.",32963
106568024842114,Rideshare Assault Support,Select Justice LLC,30204
100741402225790,Quaye Quartey for Congress,QUARTEY FOR CONGRESS,27262
9182608316,California Democratic Party,CALIFORNIA DEMOCRATIC PARTY,26548
108774614054683,American Edge Project,American Edge,22949
101445435512612,"Coalition for Public Safety Reform, Training and Transparency","Coalition for Public Safety Reform, Training and Transparency",22897
995045460505806,Sacramento Metropolitan Chamber PAC,Sacramento Metropolitan Chamber PAC,22858
134498556891640,Val Demings,Val Demings for U.S. Senate,21502
100945992520958,Rick Caruso,"Rick Caruso for Mayor 2022, 101 The Grove Drive, Los Angeles. Additional information is available at ethics.lacity.org.",21460
100945992520958,Rick Caruso,Rick Caruso for Mayor 2022,20946
127225910653607,PragerU,PragerU,18792
108887515128830,Communities United for Bass for L.A. Mayor 2022,Communities United for Bass for LA Mayor 2022,17636
102696611873936,Baytieh for Judge,Baytieh for Judge,17036
113778833499506,California Labor and Business Alliance,California Labor and Business Alliance,16965
106368917901920,Grow SF PAC,Coalition to Grow San Francisco - Grow SF PAC,15653
7030901126,Campaign for Tobacco-Free Kids,TOBACCO-FREE KIDS ACTION FUND,15205
239029093423,Dave Jones,Dave Jones for State Senate 2022,14685
195994800434559,San Manuel Band of Mission Indians,SAN MANUEL BAND OF MISSION INDIANS,14611
109092142462587,Adam Schiff,SCHIFF FOR CONGRESS,14028
115050083954556,Faisal Gill for Los Angeles City Attorney,Faisal Gill for Los Angeles City Attorney,13960
342294162453301,Planned Parenthood,Planned Parenthood Federation of America,13739
103714308898952,Protect Our Future PAC,Protect Our Future PAC,13733
372922692828,SEIU-United Healthcare Workers West,SEIU United Healthcare Workers West Local 2005,13614
101129598841978,Terry Wiley for DA,Terry Wiley for District Attorney 2022,13058
227778385157,L.A. County Registrar-Recorder,The Los Angeles County Registrar-Recorder/County Clerk,12942
103373519004702,Environmental Solutions Coalition,Environmental Solutions Coalition,12918
166935370075867,Senator Brian Dahle,Brian Dahle for Governor 2022,12677
116059863420828,Sam Yebri For Los Angeles City Council,Sam Yebri For Los Angeles City Council 2022,12621
114197411271539,Brighter Chula Vista,"Residents for a Brighter Chula Vista, Supporting Amar Campa-Najar for Mayor 2022",12534
428821014132730,Katie Porter,Katie Porter For Congress,12244
111199351501480,David Shepard for Senate,Shepard for Senate 2022,12074
104412595557198,Shawn Nelson for Judge 2022 ID #1382825,Shawn Nelson for Judge,12000
101828156534504,He Gets Us,He Gets Us LLC,11773
351521204963267,County of San Mateo - Government,County of San Mateo,11013
100722909218796,United Democracy Project,UNITED DEMOCRACY PROJECT,10905
18982436812,ACLU,American Civil Liberties Union,10485
103579495612303,Protect Tribal Gaming,CALIFORNIANS FOR TRIBAL SOVEREIGNTY  SPONSORED BY THE SAN MANUEL BAND,10289
102391291904684,Marcus Flowers For Congress,Marcus Flowers for Congress,9931
100765221381239,Dawn Addis for the Central Coast,Dawn Addis for Assembly 2022,9513
8501031021,VoteVets.org,VOTEVETS,9432
110949144713656,Eunisses for City Council 2022,Eunisses Hernandez for City Council 2022,8755
107209354867129,Team Trimino,Anthony Trimino For Governor 2022,8743
1466899026667895,Housing Now,Housing Now,8487
1228396643984955,Michelle Steel,Michelle Steel for Congress,8470
139655806061955,Doug Chaffee for O.C. Supervisor,Doug Chaffee for Orange County District 4 Supervisor 2022,8345
96935476345,Democratic Governors Association (DGA),"Democratic Action, democraticgovernors.org, not authorized by any candidate or candidate's committee.",8146
112190766925128,Marina A. Torres,Marina Torres for LA City Attorney,8091
228754857151053,House Majority PAC,House Majority PAC,8082
59744530932,Habitat for Humanity of Greater Los Angeles,HABITAT FOR HUMANITY OF GREATER LOS ANGELES,8009
109111900634787,Reverend Raphael Warnock,WARNOCK FOR GEORGIA,7821
102261682386631,Roger Niello For California State Senate District 6,Roger Niello for Senate 2022,7694
109091404777130,Nick Melvoin for School Board,Nick Melvoin for School Board 2022,7666
104686911982045,Solar and Patio Pros,Energy Genesis Inc.,7638
110022477032429,Admiral Mike Franken,"MICHAEL FRANKEN FOR IOWA, INC",7291
140499052681592,Bank of the West,BANK OF THE WEST,7287
100577781332391,Steve Padilla,Steve Padilla for State Senate 2022,7086
1632814840319802,John Fetterman,Fetterman for PA,7031
84177291169,"Dairy Farmers of America, Inc.",DAIRY FARMERS OF AMERICA INC,7019
106922758429596,Ramit Varma for Mayor,VARMA FOR MAYOR 2022,7013
123192635089,GOP,REPUBLICAN NATIONAL COMMITTEE,6853
46053668697,ACLU of Northern California,"AMERICAN CIVIL LIBERTIES UNION OF NORTHERN CALIFORNIA, INC.",6850
1812305765524944,Juan Carrillo,Juan Carrillo for Assembly 2022,6822
203805062990264,Ben Shapiro,The Daily Wire,6656
90461584470,Marc Levine,Friends of Marc Levine,6630
163684173651518,SEIU Local 2015,SEIU LOCAL 2015,6590
340645001925,San Diego County Democratic Party,San Diego County Democratic Party,6282
195564470605699,Mayor Yxstian Gutierrez,Gutierrez for Supervisor 2022,6246
103649072250430,Jessica Cha for Judge,Cha for OC Judge 2022,6169
596782207169904,Kenneth Mejia,"Mejia for City Controller 2022, FPPC ID#: 1435234",6113
110847698099863,Solarquote.org,"Lead Genesis, LLC",6111
201248453800242,My Pay My Say,Mackinac Center for Public Policy,6034
104184555633348,Cody Petterson for School Board,San Diego Education Association,6014
1316372698453411,Alexandria Ocasio-Cortez,Alexandria Ocasio-Cortez for Congress,5872
118502801658228,Young Kim,Young Kim for Congress,5870
108248211758265,Bob Hertzberg for L.A. County Supervisor,Bob Hertzberg for Supervisor 2022,5817
119787175417064,Dr. Jen Campbell for San Diego City Council,Re-Elect Dr. Jen Campbell for City Council 2022,5812
1427689927492388,RNPA Union,REGISTERED NURSES PROFESSIONAL ASSOCIATATION,5793
112630550453402,Councilmember Avelino Valencia,Avelino Valencia for Assembly 2022,5746
176036105183,Los Angeles County Democratic Party,Los Angeles County Democratic Central Committee,5713
106687405264034,SEIU Community Clinic Workers United,SEIU Community Clinic Workers United,5695
20531316728,Facebook App,"Facebook, Inc.",5622
345649856136263,Matt Mahan for Mayor,Neighbors for Matt Mahan for Mayor 2022,5503
59637554563,County of San Diego - Government,County of San Diego - Government,5440
123548795009591,Henry Bouchot,Bouchot for Senate 2022,5390
105481261624253,David Giglio for Congress,GIGLIO FOR CONGRESS,5338
177977585588602,California Hospital Association,California Hospital Association,5321
72931140459,Center for Biological Diversity,"CENTER FOR BIOLOGICAL DIVERSITY, INC.",5279
416879795094142,Kevin Jensen for Sheriff 2022,Kevin Jensen for Sheriff 2022,5174
101331215917241,MorenoforSupervisor,Working Families for Jaclyn Moreno for Sacramento County Supervisor 2022,5130
113006018065221,Dr. Cordie Williams,DRCORDIE4SENATE,5108
230459977132579,Suzie Price for Mayor 2022,Suzie Price for Mayor 2022,5008
100657592238049,Gil Cedillo For City Council,Cedillo for City Council 2022,4971
113255984133856,Joelle Gallagher for Napa County Supervisor,Joelle Gallagher For Supervisor,4964
100104419147228,Do Good Chicken,DO GOOD FOODS LLC,4957
223055747744143,Beto O'Rourke,Beto for Texas,4907
1675724796069254,"Alex Villanueva, L.A. County Sheriff",Villanueva for Los Angeles County Sheriff 2022,4901
108035061792878,No on H - Stop the Republican Con,Friends of Chesa Boudin Opposing the Recall,4728
441242156439675,Jessica Cisneros,Jessica Cisneros for Congress,4687
530728423668458,Eduardo Garcia for State Assembly,Eduardo Garcia for State Assembly 2022,4656
214821605377109,Stacey Abrams,Stacey Abrams for Governor,4611
190400207672014,American Bankers Association,American Bankers Association,4599
110177119192569,Knightscope,"Knightscope, Inc.",4594
101663439000882,Allison Holdorff Polhill for Los Angeles,ALLISON HOLDORFF POLHILL FOR LA CITY COUNCIL 2022,4558
1680317612194647,Councilwoman Dev Davis for SJ Mayor,Dev Davis for San Jose Mayor 2022,4510
590072277714798,Katrina Foley,Katrina Foley for Supervisor 2022,4499
116927601004333,Peggy Huang for Judge,Huang for Judge 2022,4404
340827527230084,Clergy Abuse Claims & Settlement,Tort Group LLC,4338
193963674061278,Cindy Chávez,Cindy Chavez for Mayor 2022,4290
304750332920654,Carl DeMaio,Reform California,4277
107238494780494,Tim McOsker for L.A. City Council,Tim McOsker for City Council 2022,4251
107103661430885,Hydee Feldstein Soto for Los Angeles City Attorney 2022,Hydee Feldstein Soto for City Attorney 2022,4205
15771560300,Earthjustice,EARTHJUSTICE,4197
104979925498254,Vote Yes on D - San Franciscans for Victims' Rights,San Franciscans for Victims’ Rights Supporting Prop D,4172
76470053424,TIAA,TEACHERS INSURANCE AND ANNUITY ASSOCIATION OF AMERICA,4168
1775685499406954,Scott Baugh,Scott Baugh for Congress,4117
101331212501656,Mike Frye for SLO Superior Court Judge,Mike Frye for San Luis Obispo Superior Court Judge 2022,4107
8934429638,Planned Parenthood Action,Planned Parenthood Action Fund,4099
305380096638473,Charles Booker,Booker for Kentucky,4074
58889234384,Planned Parenthood of Orange and San Bernardino Counties,Planned Parenthood of Orange and San Bernardino Counties,4002
11791104453,NRDC,NRDC Action Fund,3966
113553048669158,Rick Scott,RICK SCOTT FOR FLORIDA,3952
721266971604614,Alex Lee,Alex Lee for State Assembly,3918
157667060993359,Robert Garcia,ROBERT GARCIA FOR CONGRESS,3867
163148530407080,Captain Mark Kelly,MARK KELLY FOR SENATE,3863
27544763621,Prison Fellowship,Prison Fellowship,3855
162346547603209,Kevin McCarty,Kevin McCarty for Assembly 2022,3807
197908256931216,Tim Ryan,TIM RYAN FOR OHIO,3756
106131782026707,Floy4Assessor,Floy Andrews for Contra Costa County Assessor 2022,3743
1517919588502283,Christy Smith for Congress,CHRISTY SMITH FOR CONGRESS,3715
115057934426656,Mike Newhouse,NEWHOUSE FOR CITY COUNCIL 2022,3667
366741496830,Southern California Edison (SCE),Southern California Edison,3660
101006235920925,Paulette Chaffee for OC Board of Education,Paulette Chaffee for Orange County Board of Education Trustee Area 4 -2022,3646
104151054899518,ACLU California Action,ACLU California Action,3571
1639114853033755,Diane Papan,Diane Papan for Assembly 2022,3531
40217893542,AIPAC,AIPAC,3511
385473284886474,Hillsdale College,Hillsdale College,3505
7292655492,MoveOn,MOVEON.ORG POLITICAL ACTION,3503
402131763219332,James Gallagher,Gallagher for Assembly 2022,3430
1593518174052711,Candace Owens,Daily Wire,3420
87186661244,Johns Hopkins Bloomberg School of Public Health,Johns Hopkins Bloomberg School of Public Health,3387
107210631946535,Very Savvy Savings,These ads ran without a disclaimer,3374
730989337612752,Shawn Collins for California,Shawn Collins for Governor 2022,3373
88853139067,Bera for Congress,BERA FOR CONGRESS,3352
107735888492845,James McGee for Judge 2022 Office #17,James McGee for Superior Court Judge 2022,3343
129657474897,Non-Profit Housing Association of Northern California,NON PROFIT HOUSING ASSOCIATION OF NORTHERN CALIFORNIA,3314
102454465463361,Chima for Congress,CHIMA FOR CONGRESS,3288
102900705768156,Curt Hagman Listens,Ad paid for by California Real Estate Independent Expenditure Committee – California Association of REALTORS®. Committee major funding from:  National Association of REALTORS®  Not authorized by a candidate or a committee controlled by a candidate.,3282
20787991568,Senate Democrats,DSCC,3276
92925746942,Judicial Watch,Judicial Watch,3270
140357056032320,NEA Today,National Education Association,3253
230435043718484,Mitch O'Farrell,Mitch O'Farrell for City Council 2022 ID#1432537,3243
111612091415507,Ana Valencia For Assembly 2022,Ana Valencia for State Assembly 2022,3220
102740458802755,Dr. Kermit Jones for Congress,KERMIT JONES FOR CONGRESS,3216
105192955466738,VoteAmy4Judge,DDA Amy Barajas for Superior Court Judge 2022,3186
104057485639210,Connie Leyva Doesn't Listen,California Real Estate Independent Expenditure Committee – California Association of REALTORS®. Not authorized by a candidate or a committee controlled by a candidate.,3170
388316574835659,Mike Levin,MIKE LEVIN FOR CONGRESS,3159
7030901126,Campaign for Tobacco-Free Kids,Campaign for Tobacco-Free Kids,3144
121268821249550,World Central Kitchen,World Central Kitchen,3141
100631775978696,Michela Alioto-Pier for State Board of Equalization 2022,"Michela Alioto-Pier for State Board of Equalization 2022, FPPC# 1444394",3136
102771262126107,Daniel Hertzberg for State Senate,Daniel Hertzberg for Senate 2022,3134
114008535880,Foundation for Individual Rights in Education,FOUNDATION FOR INDIVIDUAL RIGHTS IN EDUCATION,3120
708677422591042,Kevin Kiley,Kevin Kiley For Congress,3097
100426321829496,Albert Corado,Albert Corado for City Council 2022,3076
100841301990335,Shanti Landon for Placer County Supervisor,Shanti Landon for Placer County Supervisor,3010
7192716362,Amnesty International USA,"AMNESTY INTERNATIONAL OF THE U. S. A., INC.",2937
118714808054,Mi Familia Vota,Mi Familia Vota,2894
11791104453,NRDC,Natural Resources Defense Council,2840
159214207491260,Mark Takano,Mark Takano for Congress,2831
309308412520731,Sandy Hook Promise,Sandy Hook Promise,2764
109896951345610,Hugo For CD13,Hugo Soto-Martinez For City Council 2022,2763
105452858781823,"Stop the Power Grab, No on B","Stop the Power Grab, No on Measure B",2731
102862295673242,Simon Silva For Chula Vista City Attorney,Simon Silva for Chula Vista City Attorney,2714
120945717945722,Uber,Uber,2706
376776419037747,Turning Point USA,"Turning Point USA, Inc.",2694
115366081170279,Los Angeles County Federation of Labor Council on Political Education,THE LOS ANGELES COUNTY FEDERATION OF LABOR COUNCIL ON POLITICAL EDUCATION,2694
2151572411731848,NextGen Policy,NextGen Climate Action,2688
103981995542610,Yes on Measures A and B - Protect our Water,VC-SAFE,2673
33832481787,People Assisting the Homeless - PATH,PEOPLE ASSISTING THE HOMELESS,2645
1851483661536521,Jeff Reisig District Attorney,Jeff Reisig for Yolo County District Attorney 2022,2635
113458994269377,California Hydrogen Coalition,California Hydrogen Coalition,2624
163202650462603,Doug LaMalfa,DOUG LAMALFA COMMITTEE,2623
6277148057,Doris Matsui,MATSUI FOR CONGRESS,2596
102033358602068,Jim Barnes,Jim Barnes for Sheriff 2022,2594
113626351223165,Joe Kerr for State Senate District 38,Joe Kerr for Senate 2022,2593
110056457850173,Jenny Rae Le Roux,JENNY RAE LE ROUX FOR GOVERNOR,2532
100813718956738,Britta for Sheriff,Britta Steinbrenner for Sheriff 2022,2500
121268821249550,World Central Kitchen,WORLD CENTRAL KITCHEN INC,2482
106735888622549,Yes to Muni,"Yes on A, Committee for Safer Streets and Reliable, Accessible Transportation",2469
1062955923841806,Jimmy Paulding for County Supervisor 2022,Jimmy Paulding for County Supervisor 2022,2455
237224053850789,Mobile Workers Alliance,Mobile Workers Alliance,2446
122632207797666,David Alvarez,David Alvarez for Assembly 2022 Special Election,2397
103382901323559,Rick Chavez Zbur,Rick Chavez Zbur For Assembly 2022,2391
38235851310,USA for UNHCR,UNITED STATES ASSOCIATION FOR UNHCR,2383
24330467048,Americans for Prosperity,AMERICANS FOR PROSPERITY,2371
927610307291393,Georgette Gómez,Georgette Gomez for Assembly 2022 Special Election,2370
100355589263947,Kylie Taitano for Congress,KYLIE TAITANO FOR CONGRESS,2323
109230491733862,Nurses and Educators for Georgette Gomez for Assembly 2022,Nurses and Educators for Georgette Gomez for Assembly 2022,2322
85945492130,EnergyBoom,Energy Boom,2318
101581948939340,Kate Pynoos for City Council,Kate Pynoos for Los Angeles City Council 2022,2315
102558898865449,Don't Break What Works,COMPUTER & COMMUNICATIONS INDUSTRY ASSOCIATION,2300
222239681125641,Long Beach Firefighters,Long Beach Firefighters,2292
105543694706664,Scott Epstein for Los Angeles City Council,Scott Epstein for LA City Council 2022,2285
265915710125206,The Nature Conservancy in California,NATURE CONSERVANCY,2270
102326269134643,Yes on H - Davis,Yes on Measure H,2256
107258967691080,Red Brennan Group,The Red Brennan Group Political Action Committee,2201
110355631674419,Working Californians For Hertzberg,Coalition of Working Cas & Public Safety in Support of Bob Hertzberg,2194
304600892905134,Hillsdale College Online Courses,HILLSDALE COLLEGE,2190
102082329165191,Stockton Now,JOSH HARDER FOR CONGRESS,2174
111264034897539,Neighbors for a Better Long Beach,Neighbors for a Better Long Beach,2158
85452072376,Newsmax,"NEWSMAX MEDIA, INC.",2141
138644937392,SEIU California,SEIU California,2138
602839483200920,Nathan Magsig,Magsig for Congress,2136
104582358918397,Becca Williams for San Diego Unified School Board: District-C,Becca Williams,2121
109266358040763,Jimmy Biblarz for Los Angeles City Council 2022,Jimmy Biblarz,2095
570092813023833,Matt Walsh,The Daily Wire,2080
155818016761,First 5 LA,First 5 LA,2067
110433194973711,Contra Costans for Progress and Justice,"Contra Costans for Progress and Justice, a coalition of business, labor and people that care about public safety in support of Mary Knox for District Attorney 2022",2050
85337666730,Republican Governors Association (RGA),REPUBLICAN GOVERNORS ASSOCIATION,2035
12695133780,Rebecca Kaplan,"Rebecca Kaplan for Supervisor 2022, FPPC ID # 1444142",1997
100165315231945,Save the Beer Economy,Anheuser-Busch,1981
1639262936323284,Angelique Ashby for State Senate,Angelique Ashby for Senate 2022,1974
105314231339794,Hollywood Chamber PAC,Hollywood Chamber of Commerce Political Action Committee,1973
102211565531357,Elect Our Mayor,Elect Our Mayor,1973
26442402549,American Hotel & Lodging Association -  AHLA,American Hotel and Lobbying Association,1971
1459676344160500,Aisha Wahab,Aisha Wahab for State Senate,1963
105173874400840,Vicente Sarmiento,Sarmiento for Supervisor 2022,1945
609392489162556,Pat Bates,Pat Bates For Supervisor,1925
109846361616313,Kimberly Ho for State Assembly,Kimberly Ho for Assembly 2022,1923
8325302025,Friends of the Earth U.S.,Friends of the Earth,1921
100684991996307,November Coalition,NOVEMBER COALITION,1918
1435071773455316,Daily Wire,The Daily Wire,1910
1517331624981243,Ashleigh Aitken,Aitken for Mayor 2022,1905
2602473023098666,Democratic Polling Center,Democratic Governors Association,1884
279798632466565,Vivian Moreno,Vivian Moreno for City Council 2022,1880
5720973755,Defenders of Wildlife,DEFENDERS OF WILDLIFE,1847
107525374739749,Anna Chouteau for Napa County Supervisor District 3,Chouteau For Supervisor 2022,1842
105777542014965,Tori Verber Salazar for District Attorney,Tori Verber Salazar for District Attorney 2022,1827
122778111789893,Jon Wizard for Assembly,Wizard for Assembly 2022,1818
109406254726644,Christina Corpus for San Mateo County Sheriff,Christina Corpus for San Mateo County Sheriff 2022,1816
500807353427258,Al Austin for Assembly 2022,Al Austin for State Assembly,1809
101190125161416,San Diego Community Power,San Diego Community Power,1803
6919066482,Brad Sherman,SHERMAN FOR CONGRESS,1792
73528878871,Center for Reproductive Rights,Center for Reproductive Rights,1786
297987334762,Jamie Raskin,Jamie Raskin for Congress,1778
135332839847855,Abortion Care Network,ABORTION CARE NETWORK,1774
108783840903642,Mateo Bedolla,Mateo Bedolla for Assembly 2022,1769
105892718610973,Erik Peterson for Board of Equalization,Peterson for Board of Equalization 2022,1769
1547129225594616,Rich Constantine for Supervisor,"Constantine for Supervisor 2022, FPPC# 1437833",1767
378347615979847,Re-Elect Mike Hestrin District Attorney 2022,Mike Hestrin for District Attorney 2022,1765
156968474833352,Stop Republicans,Stop Republicans,1763
104657602040321,Truth Media,Truth Media,1763
109086654942106,Brian Biedermann for County Superintendent of Schools,Committee to elect Brian Biedermann as County Superintendent of Schools for San Joaquin County,1751
109748660821862,The Los Angeles Alliance For Human Rights,LA Alliance for Human Rights,1751
1586922324704702,Brian Jones for Senate,Brian Jones for Senate 2022,1750
288590679617555,Louis Abramson for Assembly,Louis Abramson for Assembly 2022,1748
106964483031012,Re-elect Sheriff Carlos G. Bolanos for Sheriff 2022,Carlos Bolanos For Sheriff 2022,1740
107022908652710,Josh Pane for Assembly,Josh Pane for Assembly 2022,1735
43287633515,Action for the Climate Emergency,Action for the Climate Emergency,1727
30914589895,The International Fellowship of Christians and Jews,INTERNATIONAL FELLOWSHIP OF CHRISTIANS & JEWS INC,1724
7292655492,MoveOn,MOVEON.ORG CIVIC ACTION,1709
100517955892686,Esther Portillo,Esther Portillo For Assembly 2022,1694
103474595593740,Melissa Hammond for Judge 2022,Melissa Hammond for Judge 2022,1688
101106401649071,California Working Families Party,WORKING FAMILIES ORGANIZATION INC,1685
1461100540775171,The Tuttle Twins,LIBERTAS INSTITUTE,1683
111416482215913,California Rifle and Pistol Association,CALIFORNIA RIFLE & PISTOL ASSOCIATION INC,1667
497719423723034,Planned Parenthood California Central Coast,Planned Parenthood California Central Coast,1650
108571115179933,Care For Our Kids at Home,Care For Our Kids at Home,1644
116301935049715,Muwekma Ohlone Tribe of the San Francisco Bay Area,Charlene Conception Nijmeh,1636
106579488634144,Re-Elect Supervisor John Gioia,Neighbors for Contra Costa Supervisor John Gioia 2022,1617
110274428288444,Denis Bilodeau for Board of Equalization,Bilodeau for Board of Equalization,1614
182200225145953,Damon Connolly,Damon Connolly for Assembly 2022,1592
111381114710035,Luis Cetina,Cetina for Supervisor 2022,1591
104673965019490,Growing Almonds,ALMOND BOARD OF CALIFORNIA,1584
51405613519,Focus on the Family,Focus on the Family,1573
113903227975693,Dawn McIntosh For Long Beach City Attorney,Dawn McIntosh for Long Beach City Attorney 2022 FPPC# 1441513,1542
8492293163,Environmental Defense Fund,Environmental Defense Fund,1536
7341997111,Conservation International,Conservation International,1536
103864472260650,California Climate Accountability Project,CA Climate Accountability,1534
104760636770,Vera Institute of Justice,"VERA INSTITUTE OF JUSTICE, INC.",1519
15982076922,University of California,University of California,1516
106244251043808,America's Plastic Makers,"AMERICAN CHEMISTRY COUNCIL, INC.",1509
546643589052271,Sarah Godlewski,Sarah for Wisconsin,1509
83996318078,Change.org,"Change.org, PBC",1504
29921386086,Linda Sánchez for Congress,STAND WITH SANCHEZ,1501
103531607822207,Noticias para Inmigrantes,"Wise Rock Media, PBC",1496
103721188433935,Eric Guerra for Assembly,"Eric Guerra for Assembly 2022, FPPC #1443246.",1476
100531408739695,Shervin Aazami for Congress - CA32,SHERVIN AAZAMI FOR CONGRESS,1472
2089646811076270,Los Angeles River Master Plan Update,Los Angeles County Public Works,1455
101418125746564,Lori D. Wilson,Lori Wilson for Assembly 2022,1443
102167902428325,Alameda Forward,Alameda Forward - Yes on B 2022,1442
226354619316961,Mary Knox for Contra Costa District Attorney 2022,Mary Knox for Contra Costa District Attorney 2022,1440
111394887995363,Will Rollins,WILL ROLLINS FOR CONGRESS,1419
1122426611145321,Downey Mayor Blanca Pacheco for State Assembly,Blanca Pacheco For Assembly 2022,1419
172758932738142,PhRMA,PHARMACEUTICAL RESEARCH AND MANUFACTURERS OF AMERICA,1410
112383205925136,David Canepa,CANEPA FOR CONGRESS,1406
579945178720985,Cheri Beasley,CHERI BEASLEY FOR NORTH CAROLINA,1405
1179140112096711,Grace Napolitano for Congress,Napolitano for Congress,1401
205636320649,Sickle Cell Disease Foundation,SICKLE CELL DISEASE FOUNDATION,1385
894315020709961,CARE About Housing,"Coalition for Affordable, Reliable, and Equitable Housing",1384
114094675305938,Food Grows Where Water Flows,CA FARM WATER COALITION,1382
673117639774135,Gretchen Whitmer,Gretchen Whitmer for Governor,1381
540707072979860,Brian Maryott,Maryott for Congress,1378
1669941646417657,Senior Choice Financial,Andrea Marroquin,1375
5435784683,Greenpeace USA,"GREENPEACE, INC.",1374
100856721412114,Elen Asatryan,Elen Asatryan City Council 2022,1370
