Page ID,Page name,Disclaimer,Amount spent (USD)
312753825357,Children's Advocacy Center-Hope House,Children's Advocacy Center - Hope House,≤100
102451882353578,Andre Johnson for Gwinnett Superior Court Judge,Andre Murray Johnson,≤100
631041843716746,Rick Williams For Georgia,Rick Williams for State Senate,≤100
1695391540783254,Great Lakes Wealth,These ads ran without a disclaimer,≤100
360738334410265,Friends Of Steve Johnson,Friends of Steve Johnson,≤100
107028058446478,Tanner for Magistrate,Tanner for Magistrate,≤100
34401444206,Socially Responsible Agriculture Project,SOCIALLY RESPONSIBLE AGRICULTURAL PROJECT,≤100
100850112538665,Katrina for US Senate,KATRINA FOR SENATE,≤100
181043537365438,Brian Scott for Pinellas County Commission,"Brian Scott, Republican, for Pinellas County Commissioner.",≤100
1486914071358703,Allegheny County United,Pennsylvania United,≤100
526030407514426,Mitzi Epstein AZ Legislator,Mitzi Epstein for AZ,≤100
101754728981985,Allison Bedore for JP 4,Allison Bedore Campaign Fund,≤100
528810957518304,Gerardo Serrano for Congress,GERARDO SERRANO FOR CONGRESS,≤100
123635384326141,National Council of Jewish Women (NCJW),These ads ran without a disclaimer,≤100
226132978839353,Ask Shelli The Podcast,"Gemstone Consulting, LLC",≤100
102392635582440,Dr.sam swimming,These ads ran without a disclaimer,≤100
108315321829258,Buchanan for Montana,Buchanan For Montana,≤100
103346568682773,John Roberts for Congress,JOHN ROBERTS FOR CONGRESS,≤100
106350045385439,Re-elect Dakota Bloyd for Miller County Coroner,Dakota Taylor Bloyd,≤100
107391414191446,Tiradia,These ads ran without a disclaimer,≤100
0,Instagram User 9082075022,These ads ran without a disclaimer,≤100
106398161873695,KC3 Woodwork and Laser Engraving,These ads ran without a disclaimer,≤100
108206825104341,Charles Davis for Sanford Mayor,Charles Davis for Sanford Mayor,≤100
104278788889,Bahá’í Publishing,These ads ran without a disclaimer,≤100
57259033959,AARP,AARP,≤100
100311585651443,Jana Bradford For Prosecuting Attorney - 9W Judicial District,Jana Bradford,≤100
1165229450159349,Members United,Peter J Mackinnon,≤100
141786816970,Cruise Lines International Association - CLIA,These ads ran without a disclaimer,≤100
111185681457750,Dillon for PA Senate,Dillon for Senate,≤100
516678325461794,Senate Agency,These ads ran without a disclaimer,≤100
282861997886,Majority Leader Steny Hoyer,House Majority Leader Steny Hoyer (MD05),≤100
1269485653192452,Tombstone2,Mohammed Nasir Razavi,≤100
0,Instagram User 2904231499,These ads ran without a disclaimer,≤100
311953269253246,The Box Travels,"Yeht Kitaun Publishing, LLC",≤100
181695230703,Travis Manion Foundation,These ads ran without a disclaimer,≤100
0,Instagram User 7942415889,These ads ran without a disclaimer,≤100
122302489227,Physicians for a National Health Program,PHYSICIANS FOR A NATIONAL HEALTH PROGRAM,≤100
1025300124169519,Mitsubishi Motors,These ads ran without a disclaimer,≤100
371799640309471,Wellkind,"WellKind, LLC",≤100
111414109512852,Carissa Casbon for Lake County Board,Friends of Carissa Casbon,≤100
102805962367538,Michelle for DeKalb,Michelle for DeKalb,≤100
246770166935,Alaska Policy Forum,Alaska Policy Forum Inc.,≤100
234254443365165,Honorlock,These ads ran without a disclaimer,≤100
105914918353646,El Dorado County Local News,These ads ran without a disclaimer,≤100
111131133551811,The Locke Society,Locke Society Inc,≤100
410825846009652,Commune,"Commune Media, Inc.",≤100
107812321930025,Fire Up the Research,These ads ran without a disclaimer,≤100
204796826651228,Ecological Market,Ecological Market LLC,≤100
110540924671700,John Anderson,These ads ran without a disclaimer,≤100
100112939007245,T-Time Promo Products,These ads ran without a disclaimer,≤100
131664893560695,Origins OSU,These ads ran without a disclaimer,≤100
107164401910293,Tercer Cielo: El Reino De DIOS,These ads ran without a disclaimer,≤100
109269491708062,Danielle Duggar for Alabama House District 96,Committee for Danielle Duggar,≤100
0,Instagram User 6935116767,These ads ran without a disclaimer,≤100
103385981881603,CivicStrengths.Org,These ads ran without a disclaimer,≤100
102194888711797,Ed Brady for Jeffco Sheriff,Ed Brady for Jeffco Sheriff,≤100
238003876939202,Been There Got Out,These ads ran without a disclaimer,≤100
105762936143008,Uponor North America,Uponor North America Inc.,≤100
2532550203425383,Do Only Good Pet Food,These ads ran without a disclaimer,≤100
0,Instagram User 4859813210,These ads ran without a disclaimer,≤100
104420922161262,Whitney for Georgia,Whitney for Georgia Inc.,≤100
591337827576640,Barry Usher for Montana,Barry For Montana,≤100
107188581967105,Andy Schaunaman for City Council,Schaunaman for Council,≤100
449103895600,Jefferson Educational Society,THE JEFFERSON EDUCATIONAL SOCIETY OF,≤100
195570113812994,Meals on Wheels Diablo Region,These ads ran without a disclaimer,≤100
1646115925482062,Proncey Robertson State Representative District 7,Campaign to Elect Proncey Robertson,≤100
101288085738271,Jim Petty for Arkansas,Jim Petty For State Senate,≤100
29770886815,Marijuana Policy Project,MARIJUANA POLICY PROJECT,≤100
1419388578092947,Anna Paulina Luna,AAF Nation,≤100
405209453580678,Proud Trump Supporters,Proud Right Winger,≤100
112600257998344,Mike Valdes for Forsyth County Board of Education,"Valdes for BOE, LLC",≤100
104645885385654,Konderla for Commissioner,Chuck Konderla Campaign,≤100
173855323062109,United Way of White County,These ads ran without a disclaimer,≤100
1508257779494159,Deborah Ross,DEBORAH ROSS FOR CONGRESS,≤100
109396671649312,Mark Simon for State Representative,Mark Simon for the 108,≤100
718254898306045,Illinois Economic Policy Institute,Illinois Economic Policy Institute,≤100
1420200111329836,Alan C. Moore,Alan Christopher Moore,≤100
102719695730284,Liberty Ukraine Foundation,These ads ran without a disclaimer,≤100
111772988192404,Maggie Stern Stitches,These ads ran without a disclaimer,≤100
31365402722,The Gospel Coalition,These ads ran without a disclaimer,≤100
1989455101347558,Senator Dennis Hisey,Elect Dennis Hisey,≤100
109374912424067,Drew McKissick,DrewMcKissick.com,≤100
101135425940736,Nourd.shop,These ads ran without a disclaimer,≤100
100289562372602,Melody Bray,Bray For Georgia,≤100
658540260940077,DoneGood,These ads ran without a disclaimer,≤100
1714453962109575,Michigan Climate Action Network,Michigan Climate Action Network,≤100
100666915367994,Impeach Joe Biden,AMERICANS FOR LEGAL IMMIGRATION PAC,≤100
200990963441531,Boredom Therapy,These ads ran without a disclaimer,≤100
104426314745971,Patriotic Nana - Margaret Saari Fast,Margaret Saari Fast,≤100
89773793450,Conference on Crimes Against Women,"CONFERENCE ON CRIMES AGAINST WOMEN, INC.",≤100
61062184221,ChildFund,These ads ran without a disclaimer,≤100
107438321831997,Ed Diehl,Ed Diehl for Oregon (PAC ID: 21823),≤100
632176236951077,Alliance for Justice Action Campaign,Alliance for Justice Action Campaign,≤100
101416239114594,Jessica Neal for Kentucky State Senate,Jessica Neal for State Senate,≤100
100910082469870,Chad Bingham For Jackson County Commissioner,Bingham4JCC,≤100
102708784539043,NC Oral Health Collaborative,These ads ran without a disclaimer,≤100
969264936445051,Nevada Veterans In Politics,"Veterans In Politics International, Inc.",≤100
1577089705837768,Simply Earth,Simply Earth,≤100
1618221738450709,Lightwork for Seniors,Martha S Ramsey,≤100
904984172846045,"Nadia Shpachenko, pianist",These ads ran without a disclaimer,≤100
1425838477503979,Justin Haskins,The Heartland Institute,≤100
102642059017251,Taking Back the Narrative,These ads ran without a disclaimer,≤100
1662317660757785,Great American Syndicate,Great American Syndicate,≤100
147882195352934,Mike McKay,Delegate Mike McKay,≤100
107071285222225,Committee to Elect Mario R. Theodore to Leon County Judge Seat 1,Committee of Responsible Persons to Elect Mario R. Theodore for Leon County Judge,≤100
105308345413609,Chris Johns for Judge,"Chris Johns, nonpartisan, for Clay County Judge, Group 1.",≤100
101038118721793,City of Lost Mountain,Preserve West Cobb,≤100
795162290631372,Citrus Pregnancy Center,LIFE CHOICE CARE CENTER INC,≤100
1665774620338546,Matt Sadler,The Committee to Elect Matt Sadler,≤100
33942762466,Shalom Hartman Institute מכון שלום הרטמן,These ads ran without a disclaimer,≤100
161930788865548,Head-to-Head Voting,Anthony F Maloley,≤100
405511672970554,Central Valley Impact Republicans,Central Valley Impact Republicans,≤100
424854687974893,Elect Charlee Renaud Lear,The Committee to Elect Charlee Renaud Lear,≤100
101796208761180,Jane Hope Hamilton,JANE HOPE HAMILTON FOR CONGRESS,≤100
334603999320,106.1 KISS FM DFW,These ads ran without a disclaimer,≤100
114708317879897,Shrink Plus,These ads ran without a disclaimer,≤100
100161712642642,Kelly Tanner for AD01,These ads ran without a disclaimer,≤100
100186405921691,Tatro for Nevada,Tatro for Nevada,≤100
984421991732710,Paycheckology,Paycheckology,≤100
357146712413,Olivia Diaz,City of Las Vegas,≤100
264115353958802,Independence Party,Brent Morris,≤100
100712094640971,drawnintheact,These ads ran without a disclaimer,≤100
114616567389840,VITAL THOUGHT,These ads ran without a disclaimer,≤100
120265096677128,Lindy Blanchard For Governor of Alabama,Lindy Blanchard for Governor,≤100
195543200564610,Purdue for Life Foundation,These ads ran without a disclaimer,≤100
104253895261119,The Private Practice Pro - Kelley Stevens,These ads ran without a disclaimer,≤100
107563871726175,Anna Beth for Arkansas,Anna Beth for Arkansas,≤100
615628355607126,Creative Society,Olga Simakova Schmidt,≤100
102574018946017,Mike Schmitz for Mayor,Peggy Lee Anderson,≤100
552620208132666,Public Water Now,Public Water Now,≤100
107838748501024,Kerry Hill,Taxpayers for Kerry Hill,≤100
102381202239913,Nickisnotgreen,These ads ran without a disclaimer,≤100
100864208586452,AFGE District 3,"American Federation of Government Employees, District 3",≤100
105959115327125,Statement Apparel Co.,Statement Apparel,≤100
282891545419218,Alec Ryncavage for State Representative,Citizens fo Alec,≤100
415009999051343,Lightbright Cutz,These ads ran without a disclaimer,≤100
111216596892874,Abogado.com,Thomson Reuters,≤100
268285410285945,Our Revolution Johnson County,Thomas Gary Carsner,≤100
1952619898372368,East Wind ezine,East Wind Ezine,≤100
100832585902281,Dr. Brian Dixon for FWISD Board,Brian Dixon for ISD Board,≤100
34345791496,Orphan Relief and Rescue,Orphan Relief and Rescue,≤100
0,Instagram User 292892446,These ads ran without a disclaimer,≤100
108777231824,Manhattan Institute for Policy Research,MANHATTAN INSTITUTE FOR POLICY RESEARCH INC,≤100
107675247813984,MinutemenCoffee,These ads ran without a disclaimer,≤100
110909394960,Grameen Foundation,GRAMEEN FOUNDATION USA,≤100
118380452898779,Lisamarie Bristol for Solicitor-General,COMMITTEE TO ELECT L BRISTOL INC,≤100
102567386503340,Ed Young,These ads ran without a disclaimer,≤100
464411307639443,CABS Health Network,These ads ran without a disclaimer,≤100
2292684900771543,Justin Davis for Superior Court,Elect Justin Davis,≤100
1507117226210321,Derek Kitchen,Kitchen for Senate,≤100
101836208181009,Emily Bauman for Michigan,Committee to Elect Emily Bauman for Michigan,≤100
2153710258175434,Yesüs,These ads ran without a disclaimer,≤100
606511602767098,The Gathering for Justice,These ads ran without a disclaimer,≤100
1840987479455640,Angela C Evans,Elect Angela Evans,≤100
113208963935638,Trey Hunt - Democrat for Congress,Trey Joseph Hunt,≤100
599308390083059,Ai-Konic Graphics,These ads ran without a disclaimer,≤100
106333685271079,Mama Mini Shop,These ads ran without a disclaimer,≤100
971980592815747,Daniel Grossberg for State Representative,Grossberg for State Representative,≤100
92078048129,Go Eddie Joe Williams,Elect Eddie Joe Williams  Arkansas Secretary of State,≤100
147918345434,ATPE - Association of Texas Professional Educators,ASSOCIATION OF TEXAS PROFESSIONAL EDUCATORS,≤100
105114505495709,Dr. Gary Robinson,DOCROBFORCONGRESS,≤100
108302365219503,OConnor For Supervisor,Don O'Connor,≤100
249467225254927,The Love > hate Project,LOVE GREATER THAN HATE PROJECT,≤100
141169844763069,US Cannabis Council,United States Cannabis Council,≤100
452356574798439,Louisiana Endowment for the Humanities,LOUISIANA ENDOWMENT FOR THE HUMANITIES,≤100
100343625526981,Craig Greenberg for Mayor,Run With Craig,≤100
116487955096504,Virginia Foxx for Congress,Virginia Foxx for Congress,≤100
107231868448248,Dylan Gorski for District Judge,Dylan Gorski for District Judge,≤100
228675991017355,unspun,These ads ran without a disclaimer,≤100
340586163073586,Physicians for Peace,These ads ran without a disclaimer,≤100
634347639946885,Rep. Erick Allen,Allen For Georgia,≤100
148865959078167,Center for Freedom and Justice - Colorado,These ads ran without a disclaimer,≤100
8766613788,Saqib Ali,Friends of Saqib Ali,≤100
1443911602577177,James Brown for City Council,Campaign Fund for James Brown,≤100
0,Instagram User 6069112604,These ads ran without a disclaimer,≤100
108781735867526,Morgridge Family Foundation,These ads ran without a disclaimer,≤100
108292224211585,Artists 4 Long-Term Care,These ads ran without a disclaimer,≤100
116015728417129,Michelle Mortensen,The Michelle Mortensen Show,≤100
653918824803452,WCS Newsroom,Wildlife Conservation Society,≤100
969290446435504,Russell Fry,FRY FOR CONGRESS,≤100
102262718547519,Crazy Uncle Gil,Gilbert Cuevas,≤100
100437369276442,Johnny Coe Counts for St Johns County Commission,Johnny Coe Counts for St Johns County Commission,≤100
100935251827549,Grind Your Golf,These ads ran without a disclaimer,≤100
112712493805232,A Better Glynn,Elijah Bobby Henderson,≤100
163162542495943,David Alexis For Brooklyn,David for State Senate,≤100
468465643345509,Joshua Tree Visitors Guide,These ads ran without a disclaimer,≤100
102811111248236,Mike Sturla for State Representative,Mike Sturla for State Representative,≤100
106604714974098,MVP: Macon Violence Prevention,Macon Violence Prevention,≤100
381338125287732,Montana's Promise,NATIONAL PUBLIC PENSION COALITION,≤100
187242668522866,Matt Koleszar,Matt Koleszar for State Representative,≤100
114430694478558,Lewis for Circuit Court,Committee to Elect Todd Lewis,≤100
89670867431,Maine Farmland Trust,MAINE FARMLAND TRUST,≤100
101985595668270,Chase Studstill,Chase Studstill for District Attorney,≤100
114392601151649,Will Rucker for NV,Committee to Elect Will Rucker,≤100
225879060980,Habitat for Horses,HABITAT FOR HORSES INC,≤100
295389414405206,Single to Shaadi,Single to Shaadi LLC,≤100
0,Instagram User 3644724667,These ads ran without a disclaimer,≤100
0,Instagram User 2897921586,These ads ran without a disclaimer,≤100
103869498341565,The Juneteenth Foundation,The Juneteenth Foundation,≤100
142159185041,Artist Samuel Price,These ads ran without a disclaimer,≤100
104396194587918,C3 Solutions,These ads ran without a disclaimer,≤100
0,Instagram User 9143135827,These ads ran without a disclaimer,≤100
123480204954218,Representative Jay Xiong,Jay Xiong for House,≤100
107664581899588,Inception Security,These ads ran without a disclaimer,≤100
395998730952811,Carrie Isaac for Texas,Carrie Isaac for Texas,≤100
103342751342043,State Representative Todd Warner,Friends of Todd Warner,≤100
196099393829215,Cox Media,These ads ran without a disclaimer,≤100
203420943084617,Damnthedemocrats,Thomas R Gualano,≤100
0,Instagram User 6151255942,These ads ran without a disclaimer,≤100
372517073265396,Goodfair,These ads ran without a disclaimer,≤100
708346842676287,Dan Bishop,BISHOP FOR CONGRESS,≤100
1214686795343910,Integrity First for America,INTEGRITY FIRST FOR AMERICA,≤100
100180992680938,Ron DeSantis News,Logan Thomas Corson,≤100
108454241785879,Carl Marlinga,MARLINGA FOR CONGRESS,≤100
118119545051756,Kirk DeViere - NC Senate,Kirk deViere Campaign Committee,≤100
1585291608451100,Ted Budd,Ted Budd for Senate,≤100
113042451402081,Tops Boutiques,These ads ran without a disclaimer,≤100
110712737213610,YDS - You Don't Say: Stories from the Drew Zagorski Files,Drew Zagorski,≤100
101770425734652,Merritt Hale,FRIENDS OF MERRITT HALE,≤100
111181236964067,New Mexico News Share,New Mexico News Share,≤100
2310993162559271,Ik Onkar Bridges,These ads ran without a disclaimer,≤100
109465560444254,Roce Today,I-ROCE LLC,≤100
115565378472952,RECOVER,These ads ran without a disclaimer,≤100
141165705140,Veteran Feminists of America,These ads ran without a disclaimer,≤100
144685855898,University of Louisville,University of Louisville,≤100
106662455093154,Tyler Cochran for Kenosha County Sheriff,Friends of Tyler Cochran,≤100
215540845475754,Apenniesworth,Andrew Adam Theriac,≤100
139584736720585,"Celina Vasquez for Justice of the Peace, Pct. 4",Friends of Celina  Vasquez for Justice of the Peace,≤100
109195978366382,Re-Elect Martin Jones Chief Magistrate Judge,Committee to Re Elect Martin C Jones Chief Magistrate,≤100
100339749291167,In Less Than 30 with JoAnn Smith,Joann Smith,≤100
102933105633450,Free Dion Wright #freedionwright,These ads ran without a disclaimer,≤100
377921305987339,Reelect Judge Mike Jones - Justice of the Peace Precinct 4-1,Judge Mike Jones Campaign,≤100
331681097379867,Kids' Minds Matter,LEE MEMORIAL HEALTH SYSTEM FOUNDATION,≤100
354659445506631,Commission Shift,Commission Shift,≤100
236770820912505,Charles Graham for Congress,CHARLES GRAHAM FOR CONGRESS,≤100
409894992684800,The Yard Sign,The Yard Sign Podcast,≤100
107228178448182,William Whitesell for Judge,Whitesell for Judge,≤100
2332258203674043,The PAS Report Podcast,The P.A.S. Report,≤100
100535575901281,Jamie Barton for State Representative,Friends of Jamie Barton,≤100
108953980659634,Juan Carlos Esquivel for Doral,JUAN CARLOS ESQUIVEL CAMPAIGN FUND,≤100
234883080791381,Greene County Partnership 22,John M Stafford,≤100
288891841882812,Out of the Woods Bags,These ads ran without a disclaimer,≤100
776266585784471,PA Banking and Securities,These ads ran without a disclaimer,≤100
312320812233313,Mary Souza for Idaho Secretary of State,Mary Souza for Idaho Secretary of State,≤100
245152275619372,FloridaPolitics,Florida Politics,≤100
2025105167766682,Coach Erica,These ads ran without a disclaimer,≤100
212677670907,American Constitution Society,AMERICAN CONSTITUTION SOCIETY,≤100
108626518519783,Palay Pictures,These ads ran without a disclaimer,≤100
194211655123,"Dr. Sekandari, Clinical Psychologist",These ads ran without a disclaimer,≤100
384533924985897,Tony Brown's Journal,These ads ran without a disclaimer,≤100
101157092471761,Re-elect  Rep Mike Zalewski 21st District,Zalewski for State Representative,≤100
103564197783660,Blake Harbin for Georgia,"BLAKE HARBIN FOR CONGRESS, INC.",≤100
299457746855527,Dan Losquadro,Friends of Dan Losquadro,≤100
113583580767067,Shane Abbott For Florida House,"Shane Abbott, Republican, for State Representative",≤100
103685468880549,Raelene Blocker,Raelene Blocker,≤100
110168491593473,Ben Cross for Pope County Judge,Ben Cross for Pope County Judge,≤100
104198245492593,Primary Care Service Evolution Clinic,These ads ran without a disclaimer,≤100
100558129261746,Garcia for Nevada,Garcia for Nevada,≤100
294440927660120,Dr. Al Olszewski,AL FOR MONTANA,≤100
184612575302734,Buy American Campaign,Buy American Campaign,≤100
1784754728423434,Restoration Association of Florida,Restoration Association of Florida,≤100
105505388762020,Reagan Taylor for Madison County Judge Executive,"Friends of Reagan Taylor, Myron Fisher Treasurer",≤100
103974389650244,Amenders for Federal Spending Control,Mark Albert Meier,≤100
1464340096934621,Christine Vineyard,These ads ran without a disclaimer,≤100
112006754737537,James Luttrell For Cobb Superior Court Judge,Committee to Elect James Luttrell Inc.,≤100
0,Instagram User 8507888861,These ads ran without a disclaimer,≤100
740209026065844,Look What SHE Did,LOOK WHAT SHE DID!,≤100
101365935730371,Judge John Noverini,Citizens for Noverini,≤100
0,Instagram User 6245920775,These ads ran without a disclaimer,≤100
112406087871758,Wendy Draper for State Senate - Alabama District 12,COMMITTEE TO ELECT WENDY DRAPER,≤100
108633484293897,jhanesworth,These ads ran without a disclaimer,≤100
65127406226,Untours,These ads ran without a disclaimer,≤100
108703658327329,Cassandra Garcia Hernandez,Cassandra Garcia Hernandez for Texas,≤100
749923035033144,Barron Casteel for Texas,BARRON CASTEEL FOR TEXAS,≤100
105266995525595,Sveinbjörg Birna Sveinbjörnsdóttir í stjórn Frjálsa lífeyrissjóðsins,These ads ran without a disclaimer,≤100
1282104928597049,Heavenlyy.Art,These ads ran without a disclaimer,≤100
1733918116873254,BackWoods Mafia,Backwoods Mafia,≤100
0,Instagram User 6016023448,These ads ran without a disclaimer,≤100
106756428499135,Michele Woodhouse for Congress,Michele V Woodhouse Committee,≤100
47710973068,Voices for Cooperative Power,Voices for Cooperative Power,≤100
107010494015560,Virginians for Clean Energy,270 Strategies,≤100
55765344300,Island Institute,ISLAND INSTITUTE,≤100
1391625467725615,Elect Dr. John Cox for State Superintendent,Friends of Elect Dr. John Cox for State Superintendent,≤100
105330478819365,Bill DeVore for State House,DeVore for State House,≤100
1376852252553641,Cal Bahr,BAHR FOR SENATE,≤100
86711894400,National Write Your Congressman,National Write Your Congressman,≤100
2154447528166011,Animal Wellness Action,Animal Wellness Action,≤100
638654479829652,Jada Jo Jewelry,These ads ran without a disclaimer,≤100
62557803511,State Rep. Lynn Smith,"Friends of Lynn R. Smith, Inc.",≤100
101449549190026,Free Ukraine - Oxford Foundation,These ads ran without a disclaimer,≤100
1731753830377840,Districts Make the Difference,CALIFORNIA SPECIAL DISTRICTS ASSOCIATION,≤100
355665009819,South China Morning Post,These ads ran without a disclaimer,≤100
107174124751827,Sheigh for MN 65,Neighbors for Sheigh,≤100
105901518694062,Anna Johnson for City Commission,Anna For Fargo,≤100
92041458211,Breast Cancer Action,BREAST CANCER ACTION,≤100
103995511130782,Safe Suburbs USA PAC,Safe Suburbs USA PAC,≤100
20612127118,North Carolina Democratic Party,North Carolina Democratic Party,≤100
0,Instagram User 1413934921,These ads ran without a disclaimer,≤100
102800365712053,Clackamas County Peace Officers Association,Clackamas County Peace Officers Association,≤100
103283938197786,Transgender School,These ads ran without a disclaimer,≤100
174626401646,Senator Ralph Hise,RALPH HISE FOR NC SENATE,≤100
109136698363060,Dexter Fisher for Commissioner,DEXTER LEE FISHER | COMMITTE TO ELECT DEXTER FISHER,≤100
103585485625581,The Democratic Query,These ads ran without a disclaimer,≤100
15594718143,United WE,United WE,≤100
102658018862855,Salem News Channel,Salem Media Group,≤100
104488918412763,Cabot Image Clear Ultrasound,Cabot Image Clear Ultrasound,≤100
106986341085385,MLE Of The Maury Seldin LLC,MLE Of The Maury Seldin LLC,≤100
114160220335768,Hit No More,New York Foundling,≤100
102407532089864,Enter New Worlds,These ads ran without a disclaimer,≤100
1616728165212478,Environmental Voter Project,"Environmental Voter Project, Inc.",≤100
101883335718923,Rochelleforpa,Friends of Rochelle Culbreath,≤100
103692535361587,Linda Glisman for State Representative,Friends of Linda Glisman,≤100
1204591426371678,Common Courtesy TV,Shawn Nicholas Bryant,≤100
657708380952174,Voices of the Civil Rights Movement,These ads ran without a disclaimer,≤100
0,Instagram User 4854952230,These ads ran without a disclaimer,≤100
150012885017436,Justice Not Politics,Justice Not Politics,≤100
1191336950894416,City of Carlsbad NM Government,Social Media Manager,≤100
100180992680938,Ron DeSantis News,Ron DeSantis Store,≤100
105354525365105,Stanford Center for Innovation in Global Health,These ads ran without a disclaimer,≤100
0,Instagram User 781734148,These ads ran without a disclaimer,≤100
103652465201554,Needham Media & Marketing,These ads ran without a disclaimer,≤100
16945641940,93.3 FLZ,These ads ran without a disclaimer,≤100
102197735223862,Rodriguez Consulting & Services LLC,Rodriguez Consulting and Services LLC,≤100
101647158804605,Dee Johnson for Judge,Dee Johnson for District Court,≤100
1387062348242626,Progress Arizona,Progress Arizona,≤100
21492729544,Catholic Relief Services,CATHOLIC RELIEF SERVICES - UNITED STATES CONFERENCE OF CATHOLIC BISHOPS,≤100
102046612029258,Jeff Larner for Madison County Sheriff,Larner for Sheriff,≤100
106680755295714,Jennifer Alber Blakely for Stephenson County Clerk,Jennifer Lynne Blakely,≤100
205238189588054,"Race, Racism and the Law",Professor Vernellia Randall,≤100
114764543416,Maricopa County Clean Air,Maricopa County Air Quality Department,≤100
1845587768818403,Councilman RJ Hawk for State Rep,Councilman RJ Hawk for State Representative,≤100
220765417948995,Cobb County Democratic Committee,Cobb County Democratic Committee,≤100
108381321400442,Xeno Revolution,Xeno Revolution LLC,≤100
65727594614,Brandon Creighton,Friends of Brandon Creighton,≤100
0,Instagram User 1371440448,These ads ran without a disclaimer,≤100
364266124178919,Vitrage Art Gifts,These ads ran without a disclaimer,≤100
109697841684769,Virginia Buzz,SPANBERGER FOR CONGRESS,≤100
100120755841205,HempRevs,These ads ran without a disclaimer,≤100
552622304766179,Minerals Make Life,These ads ran without a disclaimer,≤100
362792100457336,Court-Martial.Com (C-M.C),These ads ran without a disclaimer,≤100
