Page ID,Page name,Disclaimer,Amount spent (USD)
102990981466260,Black Minds Matter,American Federation for Children,≤100
103109769744043,Supervisor Brian Maher,Friends of Brian Maher,≤100
108277644623,Missouri Democratic Party,MISSOURI DEMOCRATIC STATE COMMITTEE,≤100
102532099014341,Families 4 Every Child,Families 4 Every Child,≤100
108404321735023,BEST for KIDS in the KASD,Sarah Jean Meyer,≤100
1083734181761882,Allen Chesser for NC House,Allen Chesser for NC House,≤100
100396565960023,Say The News,These ads ran without a disclaimer,≤100
104458982208807,Nate Green For GA,Nathaniel Alexander Green,≤100
102103768750297,Asian Texans for Justice,Asian Texans for Justice,≤100
1091305144385469,Extinction Rebellion NYC,"Extinction Rebellion Organizing Committee, Inc.",≤100
1670236583219147,Jim Bowlin Mayor of Wildwood,James Ray Bowlin,≤100
1961015470831871,Bob Tyler for Rio Rancho,Robert A Tyler,≤100
916908791847627,Prosperity Michigan,Prosperity Michigan,≤100
1876287062634831,Frederick Douglass Foundation of North Carolina,The Frederick Douglass Foundation of North Carolina,≤100
459710565396,Philadelphia Republican City Committee,Republican City Committee of Philadelphia,≤100
211301852215051,Bethlehem Democratic Party,Bethlehem Democratic Committee,≤100
100897639227559,TJ Andrews for GT County Commission,Committee to Elect T. J. Andrews,≤100
7675520975,SOS Children's Villages - USA,"SOS CHILDREN'S VILLAGES-USA, INC.",≤100
103202181955066,Mark McCloskey,MARK MCCLOSKEY FOR MISSOURI,≤100
803374566410804,St. Johns County Supervisor of Elections,Wayne Edward Fusco,≤100
105362188079888,Barrick 4 DA,Barrick 4 District Attorney 2022,≤100
110359392222,International Relations Council,INTERNATIONAL RELATIONS COUNCIL,≤100
277300532288935,"Jaime Andrade, State Representative, 40th District",FRIENDS OF JAIME M ANDRADE JR ON BEHALF OF STATE REP JAIME ANDRADE,≤100
148439128199,Massachusetts Down Syndrome Congress (MDSC),MA DOWN SYNDROME CONGRESS,≤100
101407865828135,Elect Doc Washburn,Doc Washburn for Governor,≤100
102348068828997,"Jacob Ellis fighting for the Preservation, Planning and Prosperity of Aiken",Jacob G. Ellis,≤100
414091079037460,David Gibson for Saline County Tax Collector,Arles David Gibson,≤100
1639114853033755,Diane Papan,Diane Papan for Assembly 2022,≤100
108909765082596,YES for a Safer Whitehall,The Safer Whitehall Initiative,≤100
830121337093232,National Democratic Training Committee,NATIONAL DEMOCRATIC TRAINING COMMITTEE PAC,≤100
1840987479455640,Angela C Evans,Elect Angela Evans,≤100
105300935408037,Matt McKenzie for Baldwin County Commissioner - District 2,Matt Mckenzie,≤100
1829806213959874,RunawayRx,California Association of Health Plans,≤100
100846865217826,Justin Burau for U.S. Congress,Justin Burau for Congress,≤100
109607354644430,Kevin Hamm for PSC,Kevin Hamm for PSC,≤100
273755764379,Dean Young for Alabama,Larry Dean Young,≤100
108507198491383,"Jeanette Spurlock for Horry County Council, District 7","Jeanette Spurlock Horry County Council, District 7",≤100
9538894955,John F. Kennedy Presidential Library and Museum,"John Fitzgerald Kennedy Library Foundation, Inc.",≤100
205641412939153,Paul Buzzell For Mequon-Thiensville School Board,Friends of Paul Buzzell,≤100
100131411431360,Coty Powers for Arkansas House of Representatives,Coty Wade Powers,≤100
101261963326355,Joplin Professional Firefighters L59,Adam Layne Grimes,≤100
106426110706433,Greater Las Vegas STR Association,Greater Las Vegas STR Association,≤100
74472529750,Galveston County Republican Party,Galveston County Republican Party,≤100
303350876393,Greenway's Real Estate & Auction,These ads ran without a disclaimer,≤100
1562713090633117,Operation Underground Railroad,"Operation Underground Railroad, Inc.",≤100
105403318607635,Heather Donahue Pittsfield Town Councilor Candidate,Heather J Donahue,≤100
600233073348954,Nebraska Family Alliance,Nebraska Family Alliance,≤100
108152275008211,Griffin for Idaho,Griffin for Idaho,≤100
132996783419393,South Suburban Housing Center,South Suburban Housing Center,≤100
100100492343445,Gilbert for Governor,Gilbert for Governor,≤100
112077071422295,Randy M. Roe - Tipton County Commissioner District 5,Randy Mac Roe,≤100
288817061150215,"Republican Party of Jackson County, Wisconsin (RPJC)",William J Laurent,≤100
70317123312,Guidelines International Ministries,GUIDELINES INTERNATIONAL,≤100
110133424872233,Co2-1-0 Carbon Corp,These ads ran without a disclaimer,≤100
101015452601911,The Floyd County Citizens for Better Government,FLOYD COUNTY CITIZENS FOR BETTER GOVERNMENT,≤100
159451857482535,New Mexico Nature Conservancy,NATURE CONSERVANCY,≤100
106764052011104,JEFF CILA - District 95 SC House,Jeff Cila Vote SC LLC,≤100
85822259076,Northern Virginia Magazine,These ads ran without a disclaimer,≤100
285960804944325,Majestic Mountain Media,Robert Andrew Shoffner,≤100
105542518763778,Ohio ACE,"Merit International, Inc.",≤100
207985279219826,AARP Rhode Island,AARP,≤100
108625789179165,Soi Dog Foundation,These ads ran without a disclaimer,≤100
105746032021786,Moshae for District Attorney Moshae 4 DA,Campaign to Elect Moshae Donald,≤100
105197468746940,Elect Robert Stewart for Alabama State Senate District 23,Robert L. Stewart Jr,≤100
133768194093477,Savannah Maddox,Savannah Maddox for State Representative,≤100
138276702894458,Right on Crime,Texas Public Policy Foundation,≤100
101870035781663,Tim Wessel for State Senate,Tim Wessel,≤100
103110475612550,Bridget Carberry Montgomery for Iowa House,Bridget Angela Carberry Montgomery,≤100
496803543681792,New Mexico House Democratic Campaign Committee,NMHDCC,≤100
163302087408673,Stop The Donald,Stop the Donald,≤100
103022295501840,Springfield International Charter School,Springfield International Charter School,≤100
221562437861800,Central Coast Alliance United for a Sustainable Economy (CAUSE),CENTRAL COAST ALLIANCE UNITED FOR A SUSTAINABLE ECONOMY,≤100
17475614410,Hispanic Federation,HISPANIC FEDERATION INC,≤100
108892551556386,Mano DeAyala For State Rep,Mano DeAyala for State Representative,≤100
108061201494790,Will Jones for Prosecuting Attorney,Will Jones for Prosecuting Attorney,≤100
102805962367538,Michelle for DeKalb,Michelle for DeKalb,≤100
563081730692263,Chuck Eddy For Kentucky Senate 22nd District,Charles Everett Eddy,≤100
149296735883092,Barber for Arkansas,Committee to Elect David Barber,≤100
104576872176160,Laura Garcia for Superior Court Judge,Laura Garcia for Judge 2022,≤100
102583955559340,Fielder for NE Michigan,Friends of Marie Fielder,≤100
105562568624297,Kendra Bertschy for Reno Justice Court,Committee to Elect Kendra Bertschy,≤100
155457907810211,Patty's Pub,These ads ran without a disclaimer,≤100
108935285001865,Repeal Hoptown Prohibition Laws,Daniel David Brechwald,≤100
101252415820183,Veterans Choice,Tech Review Products,≤100
379618312064911,Law Offices of Miguel Inda-Romero,These ads ran without a disclaimer,≤100
107647202592570,AARP NH,AARP,≤100
111829490992955,Chiquita Jackson for MD-22,Chiquita Jackson for MD 22,≤100
112016598057691,Kathleen Bemiss for Bedford Town Council,Kathleen Bemiss,≤100
107005161695319,Herschel Walker,"TEAM HERSCHEL, INC.",≤100
125645332164506,Mike Martucci,Friends of Mike Martucci,≤100
348235559023944,Clinton Calabrese,Calabrese For Assembly,≤100
363451574868,"Get Money Out - Maryland, Inc.",Get Money Out - Maryland,≤100
2298970720347907,Social Justice Hub,These ads ran without a disclaimer,≤100
737048433117680,Darrio Melton,Darrio Melton for Senate,≤100
103979292216340,Mandy 4 MISD Place 4,Mandy 4 MISD,≤100
102814667871412,"Eric Boyce, Cedar Park City Council Place 4",Eric For Cedar Park,≤100
364368967376562,Ace Parking Lot Striping,These ads ran without a disclaimer,≤100
107481860660975,Fatima Iqbal-Zubair for State Assembly 65,Fatima Iqbal-Zubair for Assembly 2022,≤100
135691483152697,Jenison Public Schools,Jenison Public Schools,≤100
113573287915680,Vote Yes For Vigo County Schools,Vote Yes for Vigo County Schools,≤100
103246828911490,Elect Jeff Whidby for Williamson County Clerk,Committee to Elect Jeff Whidby County Clerk,≤100
113455633340681,Rabble Media,Rabble Mill,≤100
141487836538320,Mayor Rebecca Jones,Mayor Rebecca Jones,≤100
201446296572389,Compassion in World Farming (USA),Compassion in World Farming Inc,≤100
111274624895381,Diego Martinez for Congress,Approved by Diego Martinez for Congress,≤100
100945109214691,Willie Turral for Auditor,willieforauditor,≤100
100204342559960,Mark Blaxill for Congress,MARK BLAXILL FOR CONGRESS,≤100
94495405939,California Family Council,CALIFORNIA FAMILY COUNCIL,≤100
115329801149952,Gulf Gathering for Climate Justice and Joy,Green New Deal Network,≤100
180073806051057,Mark Hall for Tennessee Senate,Friends of Mark Hall,≤100
702951759806428,Randalls,These ads ran without a disclaimer,≤100
103203270425869,Affordable life and health insurance,These ads ran without a disclaimer,≤100
111629997803249,Christian Nascimento for Congress,FRIENDS OF CHRISTIAN NASCIMENTO,≤100
357492286366,Loretta Smith,LORETTA SMITH FOR CONGRESS,≤100
123397377677195,"School of International Service, AU","School of International Service, American University",≤100
103958476986020,Be Kind Be Great,These ads ran without a disclaimer,≤100
1959540891026134,Decatur County Mayor Mike Creasy,Michael K Creasy,≤100
162654970989432,Dr. Michael Daniels For Orange County School Board District 3,These ads ran without a disclaimer,≤100
487569614682924,CAPP USA,Yellow Line Productions LLC,≤100
69147011528,DonkeyTees.com,Donkey Tees,≤100
109520054693011,Trump Updates,Save America Joint Fundraising Committee,≤100
100496555113518,Kingdom in Politics,PROTHOUGHTCATIVE,≤100
228345940946267,Law Office Of Rick Gillespie-Mobley,Law Office Of Rick Gillespie-Mobley,≤100
574640662867629,Coastal Auto Rally and Show,These ads ran without a disclaimer,≤100
20531316728,Facebook App,These ads ran without a disclaimer,≤100
305380096638473,Charles Booker,Booker for Kentucky,≤100
107069818607169,Krishna Abrams for Solano County DA,Krishna Abrams for District Attorney 2022,≤100
220524861831856,Little for Willamson County Commission,Thomas Wesley Little,≤100
1439982842948797,Owl Magazine,These ads ran without a disclaimer,≤100
0,Marketplace Seller 710395309,These ads ran without a disclaimer,≤100
803317349816106,Michael Melham,Mayor Michael Melham,≤100
109217211632568,David O'Keefe for Leon County Commission District 5,DAVID OKEEFE COMMITTEE TO ELECT FOR COUNTY COMMISSIONER,≤100
100631775978696,Michela Alioto-Pier for State Board of Equalization 2022,"Michela Alioto-Pier for State Board of Equalization 2022, FPPC# 1444394",≤100
222136637797397,Erie County Democratic Party,Erie County Democratic Party,≤100
126959577337867,Senator Bill DeSteph,Friends of Bill DeSteph for Senate,≤100
164696472492,Berrien County Democratic Party,Berrien County Democratic Party,≤100
1613871958911291,ProSolar Florida,ProSolar Florida,≤100
104599425189096,Nathan White For Palm Bay City Council,Nathan Timothy White,≤100
101960074829727,NowSimplified,Simplified,≤100
1936382583048799,Councilman Tre'Von Cooper,Trevon Dewayne Cooper,≤100
104438565543951,Citizen's Alliance of Idaho PAC,Citizens Alliance of Idaho PAC,≤100
190390569730368,I Love Carson City,Jim Shirk,≤100
105295841844550,"Erica D. Williams for City Court Judge, 7th Ward Court",Committee To Elect Erica D Williams,≤100
109957618288059,Kevin Riley for Mayor,Kevin Michael Riley,≤100
304605792915025,Deborah Ferguson for Arkansas,Deborah Ferguson for State Representative,≤100
491035440996743,Efrat CRIB,These ads ran without a disclaimer,≤100
317507926716,Kearney Family YMCA - Kearney,These ads ran without a disclaimer,≤100
50003728106,Winthrop Rockefeller Institute,WINTHROP ROCKEFELLER INSTITUTE,≤100
24718773587,Sarah Palin,VIP Ad Solutions LLC,≤100
102127942292741,John H. Cameron,John Cameron for Judge,≤100
470407850162206,Badger Talks,University of Wisconsin- Madison,≤100
106669651892600,ខ្មែរអមតះ,These ads ran without a disclaimer,≤100
1590877284560136,Patti Harris,Bloomberg Philanthropies,≤100
407883686410036,Paul Kloeker for State Representative 68th District,Paul William Kloeker,≤100
117890718883640,EC Power Solar Energy - Smart Home,These ads ran without a disclaimer,≤100
105512558632248,Albert for Assembly,Friends of Matthew Albert,≤100
186022502046084,The Urban Conservative,THE URBANCONSERVATIVE,≤100
181924628560212,SumOfUs,SumOfUs,≤100
113881196745226,Mike Berger for Republican State Central Committee - 32nd District,Michael Truman Berger,≤100
111037321257870,Mickey Buchanan For 9th West Judicial District Prosecuting Attorney,Mickey Buchanan for Prosecuting Attorney 9th West Judicial District,≤100
101795722162488,Kee Bryant-McCormick for General Sessions Court Judge,Committee to Elect Kee Bryant-McCormick Judge,≤100
265599060270924,Glacial Lakes Conservancy,These ads ran without a disclaimer,≤100
104534671086796,Jessica Katzenmeyer,JESSICA KATZENMEYER FOR WISCONSIN,≤100
104733918812652,Lillie Pozatek For Fulton School Board,Friends For Lillie Pozatek,≤100
106199431950283,Vote Travis Filing-Lancaster County Commissioner District 3,Travis Filing for Lancaster County Commissioner,≤100
108892018362742,Marilyn Bennett for District Attorney,Marilyn Parker Bennett,≤100
20531316728,Facebook App,"Facebook, Inc.",≤100
100265005858628,April Wilson for Judge,Committee to Elect April Wilson,≤100
106058287863062,Turn Oakland County Green,Turn Oakland County Green,≤100
114232987432212,Colt Roberts for Shasta County Supervisor 2022,"Colt Roberts for Shasta County Supervisor, District 5 2022",≤100
104241424297600,Fems for Democracy,FEMS FOR DEMOCRACY,≤100
106706714469410,For AR People,For AR People,≤100
104509188776996,Scott Kaspar for Congress,KASPAR FOR CONGRESS,≤100
100462175781978,Joe Hyde for Tom Green County Judge,Joe Hyde for County Judge,≤100
1293750657436692,Jason Baskin - Austin City Councilman,Jason Gregory Baskin,≤100
102333435747498,Lauderhill CRA,These ads ran without a disclaimer,≤100
109714641222949,George for US Congress,FRIENDS OF GEORGE PAPASTRAT,≤100
330641537286442,Virginia Constitutional Conservatives,Virginia Constitutional Conservatives,≤100
320950088843411,Allegheny Immigration Group,Joseph P Murphy,≤100
112309944628506,Tom Kost for TX 46,Tom Kost,≤100
108132651001941,Fred G. LaChance for Fayetteville NC City Council,Frederick Gilbert Lachance,≤100
102192585696850,"Srini Raghavan - Allen, Texas - 3452",SRINIVASA RAGHAVAN NARASIMHAN FOR ALLEN CAMPAIGN,≤100
132512093435891,Westfair Online,Westfair Communications,≤100
111126381501471,Ingest The Affluent,These ads ran without a disclaimer,≤100
107475014890116,Chigozie Onyema for City Council,Chigozie Onyema for Newark,≤100
110575941557752,Elect Adrienne Simmons,Adrienne Justina Simmons,≤100
281847030270,Sierra Club Virginia Chapter,Sierra Club Virginia Chapter,≤100
348885775654412,Honeydol,These ads ran without a disclaimer,≤100
72092591211,FBI – Federal Bureau of Investigation,Federal Bureau of Investigation,≤100
802756966571454,Re-Elect Bonner for Sheriff,Friends of Floyd Bonner,≤100
106366721561276,The Coalition for Vermont Student Equity,Coalition for Vermont Student Equity,≤100
384676381708957,Education NC,Education NC,≤100
109355568310305,Support Hometown Attractions,Support Hometown Attractions,≤100
110758741513298,Hung Cao,CAO FOR CONGRESS,≤100
1613512502291594,Amarillo Matters,Amarillo Matters PAC,≤100
349737661704751,Accusing U,These ads ran without a disclaimer,≤100
64742342517,Hagee Ministries,"GLOBAL EVANGELISM, INC.",≤100
1436370423274087,Paul Walwyn For Judge,Paul Walwyn for Judge,≤100
107056121657044,Stephen D. Ward for Miller County Sheriff,Stephen Ward,≤100
1380337128721264,In Purpose Educational Services,IN PURPOSE EDUCATIONAL SERVICES,≤100
406253802918825,Lauren Book,Lauren Book for State Senate 2022,≤100
102487842398726,Jason M Smith for Habersham District 3,Jason Mark Smith,≤100
61304819713,Greater Yellowstone Coalition,These ads ran without a disclaimer,≤100
107278505110922,Steve Bergstrom for Wake Schools 2022,Committee to Elect Steve Bergstrom,≤100
1889726717940047,Assemblyman Bergen,Bergen For Assembly,≤100
479934285505809,Elect Mark Edelson,"Friends of Mark Edelson, Greg Arbogast, Treasurer",≤100
103148488382360,The Body Agency,These ads ran without a disclaimer,≤100
104847352093281,Noser for Mayor,Noser for Mayor,≤100
304822189568306,Cameron Henry,Friends of J. Cameron Henry,≤100
1309934742452627,Councilmember Andrea Boone,City Of Atlanta,≤100
104366184481062,Lois Amos for Fayette County Commission,Lois Amos for Fayette County Commissioner,≤100
101786324667613,Nathan Thomas for Cape,Committee to Elect Nathan Thomas,≤100
36474716066,Color Of Change,ColorofChange.org,≤100
100682452497775,Save Idaho Powerball,Idaho Petroleum & Convenience Store Marketers Association,≤100
110940504821769,Elect Mitch Grant Desha County Sheriff,These ads ran without a disclaimer,≤100
101790328662030,William Compton,William Dakota Compton,≤100
103048222359018,Vote Jim Cohen,Jimmy Haskel Cohen,≤100
972741382791534,Murray Plumb & Murray,These ads ran without a disclaimer,≤100
111812468884033,W.K. Kellogg Foundation,W. K. KELLOGG FOUNDATION,≤100
131306317680000,Social Goods,"Social Goods, LLC",≤100
247565365737834,Mayor Stan for Oregon,Friends of Stan Pulliam (18724)\t,≤100
289345744441595,Bard MBA in Sustainability,Bard College,≤100
105631392060945,Tim Walsh for Colorado,Tim Walsh for Colorado,≤100
286302408702729,Galatians 6:2,Galatians 62,≤100
101648092226430,Lorna West for  Pulaski County Treasurer,Friends & Family of Lorna West,≤100
101883335718923,Rochelleforpa,Friends of Rochelle Culbreath,≤100
103384182271676,James Diez,CTE Jim Diez,≤100
143226709034054,Smithfield Foods,SMITHFIELD FOODS INC,≤100
342257546269772,Commissioner Trish Becker Anastasia Mosquito Control District,Trish The Commish,≤100
58960807300,John Locke Foundation,JOHN LOCKE FOUNDATION INC,≤100
1352308314901529,Lindenhurst Knights of Columbus Council #794 - OLPH,Patrick R Corcoran,≤100
100250095962712,Safe and Reliable Energy Storage Coalition,Safe and Reliable Energy Storage Coalition,≤100
1835402526504071,No Kill Rosenberg,These ads ran without a disclaimer,≤100
931317533671151,Mid Mitten Powered by Invenergy,Mid Mitten Powered by Invenergy,≤100
110938213918134,WVFRW,WVFRW,≤100
100531408739695,Shervin Aazami for Congress - CA32,SHERVIN AAZAMI FOR CONGRESS,≤100
354851377936744,BookTV,NATIONAL CABLE SATELLITE CORPORATION,≤100
541293015923092,Georgia Right to Life,"GEORGIA RIGHT TO LIFE COMMITTEE, INC",≤100
100909691779601,Stark County Democratic Headquarters,Stark County Democratic Party,≤100
101118515905454,Blue Collar Candidate,These ads ran without a disclaimer,≤100
1828990267361918,M•I•A Media Group LLC,M•I•A MEDIA GROUP LLC,≤100
171785052910155,City of Tigard Government,"TIGARD, CITY OF",≤100
104488918412763,Cabot Image Clear Ultrasound,Cabot Image Clear Ultrasound,≤100
100477509221789,David Gonzales for Roosevelt County Sheriff,David Anthony Gonzales,≤100
102858903106626,"City of Takoma Park, MD - Municipal Government",These ads ran without a disclaimer,≤100
0,Marketplace Seller 5951843883,These ads ran without a disclaimer,≤100
213294902033976,City of Ridgecrest,City of Ridgecrest,≤100
1650167181867684,"Madison County, MS Government","MADISON, COUNTY OF",≤100
109493401204852,MediTely,These ads ran without a disclaimer,≤100
817567028361575,The Halcyon Movement,The halcyon movement,≤100
102945792155962,Geyer Balog for the 106th,Committee to Elect Geyer Balog,≤100
104037035534042,"Justin Fleming, Democrat for State Representative",Friends of Justin Fleming,≤100
681044485319441,Hoke County GOP,Christopher Wayne Holland,≤100
119953292796,Jim Banks,"JIM BANKS FOR CONGRESS, INC.",≤100
1752689034960996,The Babylon Bee,These ads ran without a disclaimer,≤100
65538457518,The Village Square,"TO THE VILLAGE SQUARE, INC.",≤100
184766966953262,Maggie4Avl,Friends of Maggie Ullman,≤100
46785153750,National Fair Housing Alliance,National Fair Housing Alliance,≤100
101568317862979,Reef Power LLC,REEF POWER LLC,≤100
105121912039995,"Murphy For Alderman - Ward 4 - Town and Country, MO","Committee to Elect David Murphy, Denise Kung, Treasurer",≤100
344736282368817,AYS Employee Leasing,Vero Beach Social Media LLC,≤100
1986185641614912,ReElect Sheriff Mendoza 2022,Adan Mendoza,≤100
1680317612194647,Councilwoman Dev Davis for SJ Mayor,Dev Davis for San Jose Mayor 2022,≤100
407664862957433,Ammar Campa-Najjar,AMMAR CAMPA-NAJJAR FOR MAYOR 2022,≤100
374520129877,ACCE Action,Alliance of Californians for Community Empowerment Action,≤100
1497903487106317,Oregon State Fire Fighters Council,OREGON STATE FIRE FIGHTERS COUNCIL,≤100
405781729459233,Billy Jones,Friends of Billy Jones,≤100
103696151958094,Texans for Eva Guzman,Texans for Eva Guzman,≤100
105718098695372,Committee to Elect Andrea Boyd,Committee to Elect Andrea Boyd,≤100
106944418589586,Mike LaRocca for State Representative PA 116,Friends of Mike LaRocca,≤100
108125948235545,Becky Cash For Indiana,Friends of Becky Cash,≤100
103048838968853,PoliticalStickers.net,David Scott Fierstien,≤100
105444348503183,Dr. Johnson for State Senate,Vote Dr Johnson,≤100
145003495664174,IdentiFreed,These ads ran without a disclaimer,≤100
105452858781823,"Stop the Power Grab, No on B","Stop the Power Grab, No on Measure B",≤100
66638939208,"California State University, Monterey Bay","California State University, Monterey Bay",≤100
1229585607062570,Jia Law Group,These ads ran without a disclaimer,≤100
100891815759102,Heather Eslick LSR7 Board Member,Heather Bernheim Eslick,≤100
108697308326701,"Gus Kramer, Contra Costa Assessor",Gus Kramer for Assessor,≤100
100675501426205,Bold Strategies LLC,Bold Strategies LLC,≤100
104254321057106,Brock for Idaho,Scott Ray Brock,≤100
101231119159882,PlanetSolar,These ads ran without a disclaimer,≤100
100782632572692,Caleb Lege for Chief,Caleb David Lege,≤100
22548382492,IWMF,"INTERNATIONAL WOMEN'S MEDIA FOUNDATION, THE",≤100
102884678991974,Craig Brill For La County Supervisor,committee to elect craig brill,≤100
100308372504330,Trucker Bob Musselwhite for South Carolina Governor,Musselwhite Warren 2022,≤100
1231122903568879,"Kirby for House of Delegates, District 44",Todd  Andrew Kirby,≤100
101320762050378,Nancy Roberts for Spearfish School Board,Nancy Lee Roberts,≤100
281282098871636,PereGonza The Attorneys,These ads ran without a disclaimer,≤100
100995995836113,Carl Andersen for Congress,Carl Andersen for Congress Committee,≤100
839764049423558,Rep. Ruben Gallego,Representative Ruben Gallego,≤100
0,Marketplace Seller 4676166575,These ads ran without a disclaimer,≤100
315275519250115,Chauncey Moulding for Jefferson County Attorney,Chauncey Tyler Moulding,≤100
1399043447065758,Rockeros Unidos USA,These ads ran without a disclaimer,≤100
192732630795577,"City of Aurora, IL, Government",These ads ran without a disclaimer,≤100
86767549338,Dariel Fernandez,These ads ran without a disclaimer,≤100
107502968080196,Elect Julie Borrelli for the Alabama House of Representatives District 40,Elect Julie Borrelli Campaign Fund,≤100
101646255371050,"Christina McCreary, Candidate for Laurel County PVA",Christina Mccreary,≤100
111317247030194,Joey Garcia,Joey Garcia for West Virginia,≤100
103514794721448,Stand Up for Chico,Stand Up for Chico,≤100
108250911405503,Fowler Secrest Community,William David Dotson,≤100
104153222226577,Jim Unites Eanes,Jim Withers Campaign,≤100
127198283114,NewTown Macon,"NewTown Macon BID Management, LLC",≤100
147447783311,Charlie Crist,"Charlie Crist, Democrat for Governor",≤100
6919565207,Islamic Relief USA,These ads ran without a disclaimer,≤100
290851614930809,Combat AntiSemitism,Combat Hate Foundation,≤100
103839262152557,Jesse Fonkert for District 9,Fonkert for South Dakota,≤100
110051005764337,"Snider & Horner, PLLC","Snider & Horner, PLLC",≤100
114249770761562,Messer for Alabama State Representative,Friends of Micah Messer,≤100
6231686654,Compassion International,These ads ran without a disclaimer,≤100
102435419132883,"Scott Gray, Candidate NYS Assembly",Friends of Scott Gray,≤100
894414900612887,William K. Boddie Jr.,"Boddie for GA, LLC.",≤100
108644335147703,Buford Speaks,Buford Speaks,≤100
107466944438688,Save Amarillo PAC,Save Amarillo PAC,≤100
100562019990818,U.S. Term Limits,U.S. Term Limits Inc.,≤100
123624513983,The Western Journal,The Western Journal,≤100
110856888193466,Blain Johnson for Minnesota House,Blain Johnson Campaign Committee,≤100
1439168163008159,Dominicanos USA,DOMINICANOS USA INC NY,≤100
121742908330,WPMT FOX43,These ads ran without a disclaimer,≤100
296093157932840,The Fulcrum,The Fulcrum,≤100
105266818674992,Hays for Texas Ag Commissioner,Susan Hays Campaign,≤100
338815492861615,Linda Holmes,Senator Linda Holmes,≤100
87377228013,Side with Love,UNITARIAN UNIVERSALIST ASSOCIATION,≤100
105884335162660,Andrew “Pickle” Simpson for 4th District Magistrate,Andrew Robert Simpson,≤100
179170062582407,"Dolli4Judge, 189th Civil District Court, Harris County, Texas - Democrat",Scoist Egzizersbbstspz Dollinger,≤100
1548467052116987,Nichols for Idaho,Tammy Nichols,≤100
112531041354860,Vito Malacari for the 119th PA State House,Vito Malacari,≤100
102397652405244,Tara Wheat for Judge,Committee to Elect Tara Wheat for Polk County Judge Group 8,≤100
1801928096578092,Radical Alert,Radical Alert,≤100
