Page ID,Page name,Disclaimer,Amount spent (USD)
109741368256503,Rebecca Raymer for State Representative,Raymer For Kentucky,≤100
927610307291393,Georgette Gómez,Georgette Gomez for Assembly 2022 Special Election,≤100
98837990702,"Penny Rich Candidate for the Register of Deeds, Orange County, NC",Penny Suzan Rich,≤100
39197138659,ACLU of New Mexico,ACLU of New Mexico,≤100
21492729544,Catholic Relief Services,CATHOLIC RELIEF SERVICES - UNITED STATES CONFERENCE OF CATHOLIC BISHOPS,≤100
100183719288146,Jennifer Killebrew for Weakley County Circuit Court Clerk,Jennifer Kay Killebrew,≤100
105793628612123,Alysse Castro for Alameda County Superintendent of Schools,"Alysse Castro for Alameda County Superintendent of Schools 2022, FPPC #1442206",≤100
101384961651764,Louisiana Policy Review,Louisiana Policy Review,≤100
106959920878115,The Well Done Foundation,"WELL DONE FOUNDATION, INC.",≤100
190754760948467,CornerStone Staffing,CornerStone Staffing,≤100
108763008048228,Truth In Politics MO,Truth in Politics,≤100
1024681364226225,Theresa Coates Ellis for Congress,THERESA ELLIS FOR CONGRESS,≤100
106816437479170,Dylan Nicholson for Farmington R-7 Board of Education,Dylan Rodney Nicholson,≤100
56281392992,NWA Equality,"Northwest Arkansas Equality, Inc.",≤100
171524415792,Coalition for Nonprofit Housing & Economic Development,Coalition for Non-Profit Housing & Economic Development,≤100
405723449859010,Re-Elect Judge Pat King,Committee to Re-Elect Judge Pat King,≤100
189042531139359,Save Alhambra Hills Open Space,Pete 4Joseph Sabine,≤100
1149977371744864,Weld Seattle,Weld Seattle,≤100
105095128474990,Matt Clifford for Ada County Sheriff,Matt Clifford for Sheriff,≤100
224986157558341,PNC,PNC FINANCIAL SERVICES GROUP INC,≤100
107475908501338,Reddy for House,Narender Reddy for State House,≤100
1386900498048900,Giving Compass,Giving.Compass LLC,≤100
243590732373934,Friends of Glenn Thompson - Team GT,FRIENDS OF GLENN THOMPSON,≤100
89660729827,National Wildlife Federation Action Fund,NATIONAL WILDLIFE FEDERATION ACTION FUND,≤100
97279934919,bp America,BP CORPORATION NORTH AMERICA INC.,≤100
93234282854,Harford County Government,Harford County government,≤100
176789922364429,Steve Daines,NRSC,≤100
108023798565948,Asphalt Cowboy L&S LLC,These ads ran without a disclaimer,≤100
152265213523,Contra Costa Clean Water Program,Sagent,≤100
345751305447288,Daugherty Water for Food Global Institute,Daugherty Water for Food Global Institute,≤100
139818052705857,99.3 KJOY,Delon Alain Bell,≤100
928750237161799,Kerry “Bubba” Underwood State House District 3,Kerry Underwood Campaign,≤100
100146652437834,Life is For Thriving,Life is For Thriving,≤100
110672478217888,Todd Reeves for Assessor,Todd Reeves for Kern County Assessor,≤100
110902971534863,Jeff Regnier for Congress,Regnier For Congress,≤100
103139372266057,Stephanie Deren for Kirksville City Council,Stephanie Corrine Deren,≤100
96643771306,Delta Dental Insurance Company,Delta Dental of California,≤100
107618598582564,Seguro Obama Care,These ads ran without a disclaimer,≤100
103552231964583,"Hiram Rodríguez, MD",These ads ran without a disclaimer,≤100
452452988519941,Commissioner John Sweet,Committee to Elect John Sweet,≤100
256145774907756,"Pam Treece for Washington County, District 2",Friends of Pam Treece,≤100
1731458707172809,Charters for Change,Elevate Chicago,≤100
86162766547,"Clark County, Nevada",Clark County,≤100
103291622352540,Councilman Orton Bellamy - Republican,Eugenia Sue Mishoe,≤100
104645981754441,Jodi Tyson for Henderson,Committee to Elect Jodi Tyson,≤100
100350125923531,Andrew Rasmussen for Brookings City Council,Andrew Rasmussen,≤100
0,Instagram User 3023845374,These ads ran without a disclaimer,≤100
248248181965096,Jesse White,Illinois Secretary of State,≤100
116737615033459,NoticiasYa Palm Springs,These ads ran without a disclaimer,≤100
192926884076581,Hartford Foundation for Public Giving,HARTFORD FOUNDATION FOR PUBLIC GIVING,≤100
100373676682707,Experience Grand Rapids,These ads ran without a disclaimer,≤100
101713629193587,David Goerg -  Journalist,David Helaman Goerg,≤100
1998294390475465,Dr. Israel Aguilar,Israel Aguilar,≤100
623576354385925,State Representative Tim Wadsworth,Committee to Elect Tim Wadsworth,≤100
1657712424449204,Deal Zone Discount,These ads ran without a disclaimer,≤100
214638098548721,"Newton County, GA Sheriff's Office",Newton County Sheriff's Office,≤100
42872222699,Dana Loesch,The Association of Mature American Citizens Inc,≤100
34477598010,Room to Read,Room to Read,≤100
123185498255,Carsie Blanton,Carsie Blanton Music,≤100
105349565441069,Palo Alto Community & Business Alliance,Palo Alto Community & Business Alliance,≤100
103851564652,Waterkeeper Alliance,WATERKEEPER ALLIANCE INC,≤100
465901370160404,Dean Casper - District 146 School Board Member,Dean Allen Allen Casper,≤100
158251810652,Placer Community Foundation,Placer Community Foundation,≤100
109943638055870,Logan Byrne for State Representative,Logan Byrne for State Representative,≤100
101482804763298,At Risk Radio,Jaye Lene Cornell Long,≤100
105101078738634,Todd Moss For Chemung County Legislature,Anthony Todd Moss,≤100
159994197369621,City Colleges of Chicago,These ads ran without a disclaimer,≤100
83960796709,Institute for Southern Studies,INSTITUTE FOR SOUTHERN STUDIES INC,≤100
103613235488527,Elect Dr. Suzanne Phillips,Campaign to elect Dr. Suzanne Phillips,≤100
113891694102,Energy Citizens,AMERICAN PETROLEUM INSTITUTE,≤100
104124098799932,Whitney Krupala for MISD,Whitney Brennan Krupala,≤100
110498914878407,Saunders for Judge,Saunders for Judge,≤100
105386362154581,Carbon Free California,Carbon Free California,≤100
106375541533568,Jesse Brown for Congress,Committee to Elect Jesse Brown,≤100
148942695133440,Northern Plains Resource Council,NORTHERN PLAINS RESOURCE COUNCIL,≤100
413010578799934,Councilwoman Sue-Ham,Sue-Ham,≤100
113553048669158,Rick Scott,RICK SCOTT FOR FLORIDA,≤100
104914675110095,Gabrielle For Georgia,Gabrielle For Georgia,≤100
211847236218083,"Bill McDaniel, City Manager",City of Plant City,≤100
109648191650801,Jacyn for Idaho,Jacyn for Idaho,≤100
106958298374655,Dr. John Jacobs for Gadsden Mayor 2022,Friends to Elect John Jacobs for Mayor,≤100
125937197447634,ACTA - American Council of Trustees and Alumni,AMERICAN COUNCIL OF TRUSTEES AND ALUMNI,≤100
129209743822549,Georgia Animal Rights and Protection,Georgia Animal Rights and Protection,≤100
103075656740,St. Johns Housing Partnership,St. Johns Housing Partnership,≤100
142063085809457,Ruben Landon Dante,Ruben Landon Dante,≤100
907919839243616,My Faith Votes,My Faith Votes,≤100
769721650048960,Sandra For Texas,SANDRA FOR TEXAS,≤100
106757418539312,Abigail Salisbury,People for Abigail Salisbury,≤100
900276213329915,Lauren Cotner For Torrance City Council 2022,Lauren Cotner For City Council 2022,≤100
104752878557391,Malise Sundstrom for Jupiter,Malise for Jupiter,≤100
103966934657253,Gary For VA,GARY FOR VA INC,≤100
108052851830262,Bob Lausten for MUD Board,Bacon Lettuce Creative,≤100
229618408976055,Carrie Rheingans for State Rep.,Carrie Rheingans for State Representative,≤100
102368142375874,Michael Griffin for Indiana Senate District 1,Committee to Elect Michael W Griffin to the Indiana State Senat,≤100
147805958594728,FaithWords,These ads ran without a disclaimer,≤100
674755692579845,Bartow Discussions,Darla Faye Williams,≤100
103705055564760,Daniel Lopez for District 2 City Commissioner,Daniel Lopez for District 2 City Commissioner,≤100
109032714591078,"William ""Bill"" Britton for Moore County Register of Deeds",Committee to Elect Britton,≤100
102468972318222,Geno Chiarelli for Delegate,Eugene Michael Chiarelli,≤100
105442191724004,Your Patriot Store,EZPole Flagpoles,≤100
28091812643,Minnesota Center for Environmental Advocacy,MINNESOTA CENTER FOR ENVIROMENTAL ADVOCACY,≤100
1754809114763257,Greater Businesses of Pearland,Chandrakanth Vemula,≤100
279913046274341,Our Watch With Tim Thompson,Our Watch with Tim Thompson,≤100
12357407443,American Friends Service Committee,AMERICAN FRIENDS SERVICE COMMITTEE,≤100
7483836629,Ancestry,Ancestry.com Operations Inc.,≤100
115057934426656,Mike Newhouse,NEWHOUSE FOR CITY COUNCIL 2022,≤100
1648191378809964,Michael Carpanzano for Bolingbrook,Michael Joseph Carpanzano,≤100
1182310845130303,Sangamon County Clerk Don Gray,Don J Gray  Jr,≤100
110893317499316,Jakub Kosiba for ACCD Board of Trustees,Jakub Kosiba,≤100
1357242494347829,Joe Buscaino,BUSCAINO FOR MAYOR 2022,≤100
112505280156649,Elect Von Pouncey,Von Young Pouncey,≤100
101437601951447,The Georgia Virtue - Bulloch,The Georgia Virtue,≤100
328873837176888,Yellville Farmers Market,These ads ran without a disclaimer,≤100
110471024966884,Free Obamacare 2022,Free Obamacare 2022,≤100
377571665762455,Blueprint To Practice Automation,These ads ran without a disclaimer,≤100
106837601539186,Brady Thomas for Sheriff,Committee to Elect Brady Thomas,≤100
106748281950967,Butterworth - Better4ID,Butterworth - Better4ID,≤100
103355385129734,The Climate Pledge,The Climate Pledge,≤100
365536960284461,East Texans for Liberty,East Texans for Liberty,≤100
108459917993990,Ahorros Solares de Arizona,These ads ran without a disclaimer,≤100
105909038352177,Open Grand Rapids ATV Routes,Doug Johnson,≤100
101392849238365,Karl Dent for Colorado HD-21,Committee to Elect Karl O’Brian Dent Sr,≤100
639133039766874,We The People - Pennsylvania,We The People - PA,≤100
1661196877509706,Evolve,Kelly A Mcgowan,≤100
109516448357320,Daniel Moore for Sanders County Commissioner District 1,Daniel Gene Moore,≤100
225900382708739,We Are NY Horse Racing,"NEW YORK THOROUGHBRED HORSEMEN'S ASSOCIATION, THE",≤100
107258967691080,Red Brennan Group,The Red Brennan Group Political Action Committee,≤100
105179348623344,Danielle For DA,Nellis for Nashville,≤100
100442169287273,"Jon Cole for Mayor - Vermillion, SD",Jonathan David Cole,≤100
577571019298839,Jo Ann for City Council,Jo Ann for Portland City Council,≤100
108926334040980,Lisa for GA,Friends of Lisa Campbell,≤100
25695554200,Planned Parenthood Advocates Mar Monte,PLANNED PARENTHOOD ADVOCATES MAR MONTE INC,≤100
114720264544782,Moving Forward,Seniors Today USA,≤100
310925405807,Citizens Climate Lobby,Citizens' Climate Lobby,≤100
101698433754691,Elect Judge Wes Allen to the Office of Alabama Secretary of State,Commitee to Elect Judge Wes Allen,≤100
678941852174026,NAIMA,Sergio D Suarez,≤100
108473464241966,Dr. Tamara Mitchell,Committee to Elect Tamara Mitchell for State Senate,≤100
313942829424,Morgan & Morgan,"MORGAN & MORGAN, P.A.",≤100
113163240250911,Legal Angle with Emmanuel D-Law Olawale,Emmanuel Olawale,≤100
110342598175823,Parsons for House of Delegates,Committee To Elect Cole Parsons,≤100
126929400651134,Pennsylvania Health Access Network,PA HEALTH ACCESS NETWORK,≤100
107460334196317,Dolan O'Rourke Real Estate Services,These ads ran without a disclaimer,≤100
1005566252861190,VOTEPROCHOICE,DEMOCRATS.COM,≤100
8895898655,Rainforest Alliance,"RAINFOREST ALLIANCE, INC.",≤100
102325682360299,Detrick For VPFF President 2022,Kurt Richard Detrick,≤100
102643385376226,Queer News Tonight,Darren Orlando Loli,≤100
105938178779977,Reed Olson for MN 2A,Vote Reed Olson,≤100
54172246106,Rand Paul,RAND PAUL FOR US SENATE,≤100
103211835008403,"Randal Clark, Hutto City Council Place 3",Randal Clark Campaign,≤100
365751630197268,Republican Party of Tulsa County,Republican Party of Tulsa County,≤100
110610054854493,"Brandon Buddy Herring for Crawford County Justice of the Peace, District 13",Brandon Ray Herring,≤100
103683624762349,The Discussion,Robert Dee Burris,≤100
53977600040,Prairie Rivers Network,Prairie Rivers Network,≤100
104059752271952,Viridian Partners,Viridian Partners,≤100
291141624664794,Bright Body,Bright Body,≤100
139572386072486,Kansas State Rifle Association,"KANSAS STATE RIFLE ASSOCIATION, INC.",≤100
106141112001963,Re-elect Michael Endicott for Johnson County Attorney,Michael S Endicott\,≤100
1376465702586897,Coloradans for Responsible Energy Development,Coloradans for Responsible Energy Development,≤100
297386819463,Assemblies of God World Missions,These ads ran without a disclaimer,≤100
2031176687154716,TC Clements,Community to Elect TC Clements,≤100
216397232833,Penzeys Spices,Penzeys Ltd,≤100
39432041915,Capital Research Center,CAPITAL RESEARCH CENTER INC,≤100
103618662258255,Modern American Living,Modern American Living,≤100
104405655524873,Michael Ford For Justice Of The Peace District 13,Michael Jeremy Ford,≤100
110177057396242,"Ramiz Hakim -  Wright City, MO Alderman",Ramiz Hakim,≤100
381627878928984,Zuarel Blue,These ads ran without a disclaimer,≤100
586464328178743,Dustin Manwaring,Manwaring for Idaho,≤100
109656011590376,Chris Scott for Casey County Judge Executive,Christopher Ryan Scott,≤100
258109613021,Stand for Children - Oregon,Stand for Children Oregon PAC,≤100
849775762047600,Councilman Jeff Dennis,Friends of Jeff Dennis,≤100
583763442315663,Andrew Glover,Andrew Glover,≤100
105602668556898,Nick Kantas for Cook County Circuit Judge,Campaign Committee to Elect Nicholas Kantas,≤100
2110411739073895,Mike Stieben for County Commission,Committee to Elect Mike Stieben County Commissioner,≤100
490338027836333,Elect Frances Holk-Jones for State Representative District 95,Frances Holk-Jones,≤100
26165067250,Juan Ciscomani,CISCOMANI FOR CONGRESS,≤100
1547457055530916,Comité  Pip Cayey Oficial,Comité Pip Cayey Oficial,≤100
107067687578,Specialized Bicycles,These ads ran without a disclaimer,≤100
42940254353,Human Rights Watch,"Human Rights Watch, Inc.",≤100
1428379550735892,Senator Sue Serino,Serino4NY,≤100
102778798623608,Dominick Barbato for East Islip School Board,Dominick Barbato,≤100
112419078111426,Stephanie Reed for Lynchburg City Council,Stephanie for Lynchburg,≤100
590254491060203,"Lawrence Wasden, Attorney General",Wasden for Attorney General,≤100
729236693908475,Montgomery Area Chamber of Commerce,Montgomery Area Chamber of Commerce,≤100
109732191463190,Sondra Wear Crabtree for Yell County Collector,Sondra Denise Wear Crabtree,≤100
350128951713224,Midland-Odessa Transportation Alliance,MOTRAN ALLIANCE INC,≤100
1456916884603276,"Bill Woodard, Frisco City Councilman Place 4",Bill 4 Frisco,≤100
1564020153865338,United Tea Party of Georgia,United Tea Party of Georgia,≤100
384006901653736,The Moore Charitable Foundation,Moore Charitable Foundation,≤100
106889641106944,Miller’s Landscaping,These ads ran without a disclaimer,≤100
119388253264855,Tocqueville Lecture Series,Benjamin Isaak Gross,≤100
253717724753132,Open Arms Pregnancy Clinic,Open Arms Pregnancy Clinic,≤100
100990079163227,Elect Daniel Fendley for District Judge,These ads ran without a disclaimer,≤100
104611742178207,Huffman Makes Room to GROW,"Huffman Supporting Kids, Schools, and COmmunities",≤100
53092472345,U.S. Capitol Historical Society,U.S. Capitol Historical Society,≤100
101939781315530,ThePeel.news,ThePeel.news,≤100
592707041080920,Stand Together,Stand Together Chamber of Commerce Inc.,≤100
107689118497671,Jared A. Page,Jared Page,≤100
103156818709000,Angela Pence,FRIENDS TO ELECT ANGELA,≤100
102603605784541,Re-Elect Judge Rich Christensen,Granier Marketing,≤100
1052306054817936,Keep Family Court Judge Doreen Goodwin,Committee to Keep Judge Goodwin,≤100
1894025304200900,DoctorClean,These ads ran without a disclaimer,≤100
748661791841793,Science on Tap - Oregon & Washington,Chelsea Cochran Schuyler,≤100
13225491633,InterVarsity Press,InterVarsity Press,≤100
100237768958546,Tennessee News Share,Tennessee News Share,≤100
110149633815869,J. Nick Payne for Judge,Campaign Fund For J. Nick Payne for Judge,≤100
120735823177026,Born To Act Now,Vladislav Twerskoi,≤100
100440699302724,Joshua Hardy for Utah House of Representatives District 1,Joshua Graydon Hardy,≤100
1701837283385591,"Walker Wood Thomas, KY State Representative, District 8",Walker Thomas For State Representative,≤100
68268644725,Northside ISD,Northside ISD,≤100
930970890268110,CareFirst Wellness Associates formerly SPMC,These ads ran without a disclaimer,≤100
467397886784853,Jay Taylor for WV,Jay Hill Taylor,≤100
109917434958143,Progressive Style,Patrick Stuart Bothwell,≤100
277365212921237,Yuba Vision,Alton Gabe Wright,≤100
108529004950807,Shane Foster for Sherwood Mayor,Shane Foster,≤100
100211855871312,Elect Linda Jako for Clark County Clerk,These ads ran without a disclaimer,≤100
108118198193753,Baby Patriot LLC,Baby Patriot LLC,≤100
96011276891,Heinemann Publishing,Heinemann Publishing,≤100
109345948376680,Candice For Congress,CANDICE DEAL-BARTELL FOR CONGRESS,≤100
104482607996255,Discourse Magazine,MERCATUS CENTER INC,≤100
102395528851697,Steve Gainey for Brunswick Co. Board of Education,Steven Morris Gainey,≤100
172635436826883,Wilsonforwindsor,Wilson for Windsor,≤100
100237962618115,Don Thrasher For Judge Executive,Donald E. Thrasher,≤100
529093173966023,Kay Kirkpatrick,Kay for Senate,≤100
349904785020665,Law & Liberty,"Liberty Fund, Inc.",≤100
450222075006193,Murphy Springs Farm,Kevin Patrick Murphy,≤100
18983389920,Open Society Foundations,Open Society Foundations,≤100
147136495326466,ESL Federal Credit Union,These ads ran without a disclaimer,≤100
104240595522524,Michael West for Harrison Township Assessor,Michael Wayne West,≤100
206690159663661,U.S. Congressman Vicente Gonzalez 2022,VICENTE GONZALEZ FOR CONGRESS,≤100
0,Instagram User 6351062657,These ads ran without a disclaimer,≤100
113766156678353,Vito LaBella For New York,Vito J Labella,≤100
110740242303537,CAVU,CAVU (Climate Advocates Voces Unidas),≤100
112841831309523,Our American Real Estate,Our American - Real Estate,≤100
345324292309306,AdVenture Capitalist Community,These ads ran without a disclaimer,≤100
1778198349149076,"Senator Richard Lindsay, WV 8th District",Friends of Richard Lindsay,≤100
92646793962,Steamboat Resort,These ads ran without a disclaimer,≤100
103028765046689,Noah Robinson for Sheriff,Noah Robinson for Sheriff,≤100
104546085034181,Legislator Ben Geller,Benjamin Noah Geller,≤100
110361284907173,Erin for Schools,Erin for Schools,≤100
113757724545917,Brianna Doran for Brookings City Council,Brianna Doran for Brookings City Council,≤100
104237051371667,Fandiem,Fandiem Inc,≤100
529660253742398,Hawaiian Electric,"HAWAIIAN ELECTRIC COMPANY, INC.",≤100
104998288732541,Trish Haight for PA State Representative District 80,Friends of Trish Haight,≤100
1941770196095235,Sherman Hardy for County Executive,The People to Elect Sherman Hardy,≤100
1004492946307528,"Representative Spencer Gosch, District 23",Spencer Ray Gosch,≤100
109171010444924,Richard Yaws - Gun Barrel City Council Place 1,Richard Yaws - Gun Barrel City Council Place 1,≤100
279483032583224,Collins for Council,Collins for Council,≤100
107831749237075,EBONY,These ads ran without a disclaimer,≤100
674093346356017,Senator Jen Kiggans,KIGGANS FOR CONGRESS,≤100
277718676477,North Central States Regional Council of Carpenters,North Central States Regional Council of Carpenters,≤100
1153947761302254,Serino4NY,New York State Senate Republican Campaign Committee,≤100
103050152320143,Will Furry For Flagler School Board,Will Furry for Flagler County School Board,≤100
105239511089757,Inmigrantes al Día,Inmigrantes al Dia,≤100
999015486922043,Elvin Villalobos,Elect Elvin Villalobos,≤100
112242974696270,Gramlich for Arkansas,Gramlich for Arkansas,≤100
135528903145833,Peter Ohtaki,Paid for by Ohtaki for Congress,≤100
234218367390878,Friends & Neighbors,FRIENDS & NEIGHBORS OF MARTIN COUNTY,≤100
10128918116,Gavin Newsom,NEWSOM FOR CALIFORNIA GOVERNOR 2022,≤100
120500331298489,League of Women Voters Irving,LEAGUE OF WOMEN VOTERS OF IRVING,≤100
106512924097985,Tammy Johns,Tammy Johns,≤100
1633123746921759,OC WISE,"Orange County Water Independence, Sustainability & Efficiency",≤100
596320577211238,Harold Byrd for Manatee County School Board District 2,Harold E Byrd Jr Campaign,≤100
111893659171316,Choose Love,Choose Love Inc.,≤100
168111207046729,The Field's Edge,FIELDS EDGE,≤100
111740454755164,Sabrina Grace For WV Senate—District 6,Sabrina Lynne Grace,≤100
1772629373062398,"Georgina Cecilia Pérez, TX State Board of Education",TEXAN Public Strategies,≤100
106507982029857,Al Carlson for Fargo,Carlson for City Commission,≤100
2805835519430125,Elect Cindy Edwards,Committee to Elect Cindy Edwards,≤100
101424645858144,Jessica For Mission Place 1,Erika Barrera,≤100
937443692972757,District 6 Commissioner: Bakari F. Burns,"City of Orlando - Commissioner, District 6",≤100
195900440957464,Jeremy Shaffer for Congress,Friends of Jeremy Shaffer,≤100
102015235791042,Weston Balch - Manheim Township - District 16 Republican Committeeman,Weston Balch,≤100
369223293160562,The Financial Guys,The Financial Guys,≤100
264708616937941,State Representative Jim Dotson for State Senate,Jim Dotson Campaign,≤100
1199539610087847,Twin Ports Democratic Socialists of America,Twin Ports DSA,≤100
105869365443705,Realtors for Edwards,National Association of REALTORS®,≤100
35787019800,Episcopal Divinity School at Union,Union Theological Seminary,≤100
105946117709896,Elect Corey Seats Prosecuting Attorney,Corey Seats for Prosecuting Attorney,≤100
362967587833131,Friends of Meleesa Johnson,Friends of Meleesa Johnson,≤100
101897918996673,Chris Flanagan for State Representative for the 1st Barnstable District,Committee to Elect Chris Flanagan,≤100
101837289064163,Kendra for Arkansas,Kendra for Arkansas,≤100
126105480781184,Texas Home School Coalition (THSC),TEXAS HOME SCHOOL COALITION,≤100
104327108841634,Graham E. Wilson for Criminal Court Judge,Committee to Elect Graham E. Wilson,≤100
401757013244289,The Kari Lake,Lake For AZ,≤100
100755749226849,Hyrum Cox for Utah County Sheriff,Hyrum Wayne Cox,≤100
101343702496576,Delain Prewitt for Leesville City Council District 4,The Campaign to Elect DeLain Prewitt for Leesville City Council District 4,≤100
104100622212046,Prescott Paulin for IL State Rep,Prescott Paulin,≤100
793369484086475,Hughes Group,These ads ran without a disclaimer,≤100
1524340297596743,Sean C. Ewing for North Carolina,Sean Ewing for North Carolina,≤100
101763365490994,Commonwealth Alliance for Housing Solutions,Commonwealth Alliance for Housing Solutions,≤100
311367366937,Republican Party of Rock County,Republican Party of Rock County,≤100
1723300324586437,The American Muslim & Multifaith Women's Empowerment Council,AMERICAN MUSLIM AND MULTIFAITH WOMEN'S EMPOWERMENT COUNCIL,≤100
428173550596440,Rep. Ritchie Torres,Office of Congressman Ritchie Torres,≤100
169731464548,Sesame Street,SESAME WORKSHOP,≤100
130422360336225,"Brogan Financial, Inc.",Brogan Financial,≤100
599491376781423,Stacelynn K.M. ELI,Friends of Stacelynn Eli,≤100
102918290599,Bill Foster,Office of U.S. Congressman Bill Foster,≤100
108855888245318,Vote Hallgren,Committee to Elect Elizabeth Hallgren,≤100
997180920417798,Marion County DA Paige Clarkson,Friends of Paige Clarkson,≤100
101825298986393,Francisco Paulino for State Rep,Francisco E Paulino,≤100
131763143985,Springfield Public Forum,"SPRINGFIELD PUBLIC FORUM, INC.",≤100
945455208962159,For Everyone Collective,For Everyone Collective,≤100
405623586528903,Equus Now Cincinnati,These ads ran without a disclaimer,≤100
105683954933727,The American-Ethiopia Public Affairs Committee-AEPAC,AEPAC,≤100
101728109096879,Jimmy Kendrick for Constable 2nd District,Jimmy Lynn Kendrick,≤100
214260218918869,Georgia Baptist Public Affairs Ministry,EXECUTIVE COMMITTEE OF THE BAPTIST CONVENTION OF THE STATE OF GEORGIA,≤100
141568099906282,Selacollab,SELA Collaborative,≤100
108228448477899,Robert Leadbeter for State Representative,Elect Robert Leadbeter,≤100
191175884250955,AltaMed Health Services,AltaMed Health Services,≤100
101910727881582,Schmidt For Illinois,Schmidt for Illinois,≤100
103675825593321,Sturgis Listens,"Sturgis Listens, LLC",≤100
563602790331048,Space Coast Young Republicans,Josiah Michael Gattle,≤100
102730765676967,Castle Exteriors Austin,These ads ran without a disclaimer,≤100
565108056966122,Curiosity Stream,These ads ran without a disclaimer,≤100
104528738786149,Stephanie 4 Frisco ISD,Stephanie Elad for FISD Campaign,≤100
199826043375900,Larry Hogan,An America United,≤100
404774046800358,Judge Gunner DeLay for Supreme Court,Brandon Ray Howard,≤100
135403221037,City Journal,City Journal,≤100
110511574165612,Americans for Accountability in Leadership,Americans for Accountability in Leadership,≤100
187411354950002,Boone County Republicans - Missouri,Boone County Republican Central Committee,≤100
115250231163859,Boyle for Idaho,Committee to Elect Judy Boyle,≤100
100680755855980,Chris Watkins for Peoria County Sheriff,Christopher M Watkins,≤100
367896363764927,Milton for Mayor,Milton for Mayor,≤100
104888014891398,Alexi For Us,CITIZENS FOR GIANNOULIAS,≤100
157823291451684,HBCU Culture Shop,These ads ran without a disclaimer,≤100
101275422471430,Retain Judge Teri Lynn Dennings,COMMITTEE TO RETAIN JUDGE TERI LYNN DENNINGS,≤100
344414872859730,Quotes by Christie,These ads ran without a disclaimer,≤100
103880631874223,Larry Silver Jr for Mayor of  Greenfield Indiana,Larry Wayne Silver,≤100
100946592325631,Matt Bennett for Alapaha Judicial Circuit District Attorney,Matthew Benjamin Bennett,≤100
154952582962914,Darius D. Stover - The Stover Group,Family Advantage Plus Group,≤100
100540971962779,Localyst,"Accelerate Change, Inc.",≤100
