Page ID,Page name,Disclaimer,Amount spent (USD)
100813718956738,Britta for Sheriff,Britta Steinbrenner for Sheriff 2022,≤100
104993075453984,Phil Wilson for County Commissioner District 10,Philip Eugene Wilson,≤100
113923094536491,Mike Sigler for Congress - 22nd District,MIKE SIGLER FOR CONGRESS,≤100
1113191128705058,Commissioner Hope S. Harmon,Hope Sharron Harmon,≤100
126357934012,Allan Kittleman,ALLAN KITTLEMAN FRIENDS OF,≤100
108151828306114,Re-Elect Lynn Shue for Cabarrus County Commissioner,Committee to Re-Elect Lynn Shue - Cabarrus County Commissioner,≤100
1226742374156920,"Ben Mackey, Dallas ISD School Board Trustee, District 7",Ben Mackey for DISD,≤100
69325239051,A Cappella Books,ACAPPELLA BOOKS INC,≤100
1470151473238140,Save the Boundary Waters,Northeastern MInnesotans for Wilderness,≤100
1450443835060891,Robert Byrd for Coroner,Robert Byrd for Coroner,≤100
107209354867129,Team Trimino,Anthony Trimino For Governor 2022,≤100
1762525927103467,DeVries Media Company,Eric Peter Devries,≤100
168876449866088,The Years Project,THE YEARS PROJECT,≤100
858210161010020,Tom Malinowski for Congress,TOM MALINOWSKI FOR CONGRESS,≤100
348498485341099,DA Montgomery,22nd JDC District Attorney's office,≤100
317544325352590,Braxton Winston for Charlotte City Council,Committee to Elect Braxton Winston II​,≤100
203276240213924,Rep. Stephanie T. Bolden,Delaware House Democratic Caucus,≤100
103351722296015,Elect Julissa,Committee to Elect Julissa Jumper,≤100
149061431822284,Vote Yes Temple,Hope Arlene Koch,≤100
292351509697,Jerusalem Prayer Team,Jerusalem Prayer Team,≤100
1756197751317157,"Christian Family Medicine, Inc.",Reed Marketing,≤100
407530732775934,Paul L Taylor,Friend of Cumberland County,≤100
604334372911017,Iowa Treasurer of State Michael L. Fitzgerald,Iowa ABLE Savings Plan Trust,≤100
339095013151797,Linda Sarabia for Palmview Mayor,Linda Gabriela Sarabia,≤100
221401431386940,Pramila Jayapal,PRAMILA FOR CONGRESS,≤100
538084753217622,Ryan For Florida Agriculture Commissioner,Ryan Morales 2022,≤100
159708220707897,Democracy Prep Public Schools,These ads ran without a disclaimer,≤100
706589542800162,Center for Sustainable Stewardship,These ads ran without a disclaimer,≤100
180171582103737,Nottawaseppi Huron Band of the Potawatomi,These ads ran without a disclaimer,≤100
383682631962691,Forrest Shaw,These ads ran without a disclaimer,≤100
106617368440724,Please Vote & Elect Robert Herrera,Robert Herrera Jr,≤100
143533592818792,Houstonians for Great Public Schools,Houstonians for Great Public Schools,≤100
217026408340842,Food & Environment Reporting Network,FOOD & ENVIRONMENT REPORTING NETWORK INC,≤100
117390304991592,Richard Duncan: Economics in the Age of Paper Money,Target Marketing Digital LLC,≤100
338815936741517,Jackie Espinosa for Osceola County Commissioner District 4,"Jackie Espinosa, Democrat for Osceola County Commission District 4",≤100
101909331456199,Earth Right Mid-Atlantic,These ads ran without a disclaimer,≤100
106451501999678,Gail Pellerin for Assembly,Gail Pellerin for Assembly,≤100
161714690523234,City of Providence,Committee to Save Providence,≤100
514446149038714,The Iowa Standard,The Iowa Standard,≤100
103117294876457,Project Destiny Texas,Project Destiny Texas,≤100
108152275008211,Griffin for Idaho,Griffin for Idaho,≤100
101742374963551,My HBCU Matters,My HBCU Matters,≤100
103322421921933,Spencer Toder for Senate,SPENCER TODER FOR SENATE,≤100
1562669384013149,State Representative Ina Minjarez,Ina Minjarez Campaign,≤100
104673102150359,Tony Grady for Lt. Governor of the State of Nevada,"Unrelenting Media, Inc.",≤100
100220465399351,Global Celebration Online,These ads ran without a disclaimer,≤100
122583927935240,Teenbreaks,Sandra C Mason,≤100
100837885794768,RosaMartinez4Idaho,Rosa Martinez 4 Idaho,≤100
102428545703720,Michelle Scharf Davis County Clerk,Friends of Michelle Scharf,≤100
112081817291028,Jennifer Virden for Mayor of Austin 2022,Jennifer For Austin Campaign,≤100
111466947353433,James Hieb for Oregon,James Allan Hieb,≤100
102697689024814,Franklin Blvd Media,These ads ran without a disclaimer,≤100
187990385141270,Dan Buttermann for Assembly,Daniel James Buttermann,≤100
153588847304,UNITE HERE Local 1,UNITE HERE Local 1,≤100
109183717573500,Orjanel Lewis,Orjanel Lewis for Fort Bend,≤100
106951364204044,B.T. Parker for Superior Court Judge,iDigitality Solutions,≤100
237052729573,African Diaspora Film Festival (ADFF),Diarah Ndaw Spech,≤100
283842448975,The Village for Families & Children,"VILLAGE FOR FAMILIES & CHILDREN, INC",≤100
108898301636676,Schoenbeck for House,Schoenbeck for House,≤100
107461807302358,Kronda Thimesch for Texas House,Kronda Thimesch Campaign,≤100
882431925290123,BookBaby Bookshop,"DIY Media Group, Inc. dba BookBaby",≤100
192609620649,The University of Chicago,The University of Chicago,≤100
100408316003572,Team Fitzpatrick,BRIAN FITZPATRICK FOR CONGRESS,≤100
111393882812494,Amy McGrath,The American SOS Project,≤100
1712870642319492,Beaver County Democrats,Beaver County Democrat Committee,≤100
103858728827572,Joe Hanes for Verona Area School Board,Joe Hanes for VASD Board,≤100
105754471961413,Jason Maxwell for Arkansas House Representive District 12,Jason Scott Maxwell,≤100
100106008488728,Ditto Kids,Ditto Kids LLC,≤100
85054374416,Nebraska Appleseed,NEBRASKA APPLESEED CENTER FOR LAW IN THE PUBLIC INTEREST,≤100
1622717057978219,Flagstaff Mayor Paul Deasy,Paul Deasy for Flagstaff Mayor,≤100
114049044518484,Angela McClure for Alabama State House - 20,Angela McClure for State House - District 20,≤100
219224241438635,Compassion & Choices,COMPASSION & CHOICES,≤100
107052641871633,Dan Theno for Brown County Board District 5,Daniel Theno,≤100
1742473229391069,Jerry Gilliam for Christian County Judge Executive,Jerry Wayne Gilliam,≤100
13204463437,"UNHCR, the UN Refugee Agency",These ads ran without a disclaimer,≤100
105160365430437,Joe Dalia for Nevada AD 29,Committee to Elect Joe Dalia,≤100
0,Marketplace Seller 7162563960,These ads ran without a disclaimer,≤100
121268821249550,World Central Kitchen,WORLD CENTRAL KITCHEN INC,≤100
107909048523190,Zelos for Oregon,Committee to Elect Zeloszelos Marchandt,≤100
103404955646310,David Frenkel for Hamilton Wenham School Committee,David Immanuel Frenkel,≤100
123548795009591,Henry Bouchot,Bouchot for Senate 2022,≤100
2248641948741400,Indigenized Energy Initiative,EARTH ISLAND INSTITUTE INC,≤100
102511705674649,Torrick Alan Ward for Judge,Committee to Elect Torrick Alan Ward,≤100
130945114804,World Jewish Congress,WORLD JEWISH CONGRESS AMERICAN SECTION INC,≤100
1816761828344225,I love Oviedo / Winter Springs,YOUR BRAND VOICE INC.,≤100
106175678497318,Ciran Hadjian for City Council,Ciran Hadjian for Pasadena City Council 2022,≤100
293977828617,Jim Kuretski for Jupiter Mayor,Jim Kuretski for Jupiter Mayor,≤100
109916848248063,"Joni Smith, Keller ISD Board of Trustees, Place 2",Joni Shaw Smith for Keller ISD School Board,≤100
268868046463126,Beacon Center of Tennessee,BEACON CENTER OF TENNESSEE,≤100
1713983962155278,Pickens County Observer,Pickens County Observer,≤100
299028698661,Association of Classical & Christian Schools,These ads ran without a disclaimer,≤100
135137586501712,Placer County Deputies,Placer County Deputy Sheriffs' Association,≤100
103640025552987,Lisa Rave for Senate,Lisa Rave for Senate,≤100
372117009865099,"Delegate Dianna Graves, District 38",Committee to Elect Dianna Graves,≤100
14084625156,Susan G. Komen,These ads ran without a disclaimer,≤100
1003592146347827,WikiLaw,Matthew Dennis Mcmaster,≤100
259427454135418,California Policy Center,California Policy Center,≤100
1401420106565358,Governor Doug Burgum,Governor's Summit on Innovative Education,≤100
593431594189847,Brawdy Construction,These ads ran without a disclaimer,≤100
106251411756693,Scott Harness for Tulare County Supervisor,Harness for Supervisor 2022,≤100
109803798229061,Jason Day for Washington County Commission,Jason Day for Commissioner,≤100
123791810559,Young Professionals Organization of Greater Peoria,Young Professionals of Greater Peoria,≤100
83290028957,Care Net,CARE NET,≤100
106128781652194,"Retrospect Counseling, PLLC",These ads ran without a disclaimer,≤100
101328432468474,Re-Elect Chief Judge Rob Leonard,Friends of Judge Leoanrd,≤100
118190095471870,Sheriff Tyler DeArmond,Tyler Dearmond,≤100
269348454714,IMB,"INTERNATIONAL MISSION BOARD OF THE SOUTHERN BAPTIST CONVENTION, THE",≤100
102195485629133,Ernest Pasley for Clark County Magistrate District 2-elect,These ads ran without a disclaimer,≤100
108618114967769,Odessans for Ethical Leadership - OEL,ODESSANS FOR ETHICAL LEADERSHIP,≤100
90209763480,The Federalist Society,The Federalist Society,≤100
106210821894913,James Frietze for Sheriff,Victor Villalobos,≤100
442553959494293,Center for Climate Integrity,Center for Climate Integrity,≤100
102050669027964,Boyer4Gallatin,Boyer for Gallatin County,≤100
757754000983566,New Haven Republicans,New Haven Republican Town Committee,≤100
458142697588014,AARP Public Policy Institute,AARP,≤100
134758180394,EcoAction Arlington,EcoAction Arlington,≤100
104679065211711,Traci Park for L.A. City Council,Traci Park for City Council 2022,≤100
108476877369049,Judi Adams for District 21,Judith Marie Adams,≤100
101602119144937,Tolls Are a Double Tax,Louisiana Motor Transport Association,≤100
1209457952426541,NILC Immigrant Justice Fund,NILC Immigrant Justice Fund,≤100
2230864943899116,Lake Country Republicans,Republican Party of Waukesha Party,≤100
101231538879953,David B. Hooten for Oklahoma State Treasurer,Hooten4Treasurer2022!,≤100
282861997886,Majority Leader Steny Hoyer,House Majority Leader Steny Hoyer (MD05),≤100
24834672986,Hip Hop Caucus,HIP HOP CAUCUS EDUCATION FUND,≤100
108748565833974,Purpose,Purpose,≤100
237926860077772,Bill Skains,Bill Skains for Alderman,≤100
104883625439891,Joydeep Gupta for Ohio Democratic Party Central Committee Senate Dist-19,Joydeep Gupta,≤100
100996105931390,Michael Borgie,"OFF THE WALL ADVERTISING, INC.",≤100
102886368285131,The Wichita Beacon,These ads ran without a disclaimer,≤100
106541331920631,Maricopa Momentum,Maricopa Momentum,≤100
109439817056024,Elect Logan Endow,Friends of Logan Endow,≤100
1484292618481334,Peter Lyford State Representative,Peter Lyford,≤100
59543893235,National Constitution Center,National Constitution Center,≤100
1720459191580935,Children's Health Andrews Institute for Orthopaedics & Sports Medicine,Children's Health System of Texas,≤100
254116287083,World Concern,World Concern,≤100
104649648769012,Tyler For Knox,Tyler For Knox,≤100
1999736710310261,"Sunny Park for OC Supervisor, District 4",Sunny Park for OC Supervisor 2022,≤100
111983644748221,Nora Lott Haynes for Senate,Nora Lott Haynes for Senate,≤100
1722554628017424,Lucas- Fairview City Commissioner,Vote Scott Lucas,≤100
109275964973704,Scott Bilger for Bartlesville Public Schools - Board of Education,Michael Wray,≤100
110479178287252,Citizens for Cameron County Drainage District No. 6,Gerardo Medina,≤100
1079789672084038,SimonBooks,Simon & Schuster,≤100
852187284832856,"City of Cookeville TN - Ricky Shelton, Mayor",Michael Richmond Shelton,≤100
109057438321508,Elena Baca-Santa Cruz for City Council,Elena Baca-Santa Cruz for Moreno Valley City Council,≤100
143298629076767,Libertarian Party of Kansas (LPKS),Olivia Nicole Hayse,≤100
111474151338202,Committee to Elect Kari MacRae,MacRae committee,≤100
113709691218143,John Williams for District Court Judge,John Williams for District Court Judge,≤100
163420500342690,Bryce Reeves,Reeves for Congress,≤100
1081518195353411,Erik Rock - Rock Productions LOL,Erik Andrew Rock,≤100
110768078091475,Johnny S. Johnson for Constable,Johny Scott Johnson,≤100
894315020709961,CARE About Housing,"Coalition for Affordable, Reliable, and Equitable Housing",≤100
101054509137505,Spann for Judge,Committee to Elect Jonathan A. Spann,≤100
109750154955698,Neil Friske for Michigan State Representative,Committee To Elect Neil Friske,≤100
364809870351284,Power2Parent,Charlie Nicole Melvin,≤100
100339749291167,In Less Than 30 with JoAnn Smith,Joann Smith,≤100
135152549850040,Richard S. Holt,Shawn Holt,≤100
100586261390307,Raise Your Hand Texas Advocate - South Texas,Raise Your Hand Texas,≤100
109277847569893,Healing Cortland,"CORTLAND AREA COMMUNITIES THAT CARE COALITION, INC.",≤100
48638948196,"City of Winston-Salem, NC - Government",CITY OF WINSTON-SALEM,≤100
258692361177731,Cristina Garcia for Congress,CRISTINA GARCIA FOR CONGRESS,≤100
120778038066631,EveryLibrary,EveryLibrary,≤100
106577518171135,Christa Williams,Christa Williams,≤100
67011831040,Canon Press,Canon Press,≤100
101492679195019,Ryan Dude Ainsworth for Roosevelt County Sheriff,Elliott Marketing,≤100
1083077798398908,LaComelaw,These ads ran without a disclaimer,≤100
107128841851361,Brian Smith for Kern County Supervisor 2022,Brian Smith for Supervisor 2022,≤100
2131915527094488,Your Breckinridge County Republican Party,These ads ran without a disclaimer,≤100
98201257358,"City of Arlington, TX - City Hall","City of Arlington, TX",≤100
112394563589719,Pima County Department of Environmental Quality,Pima County,≤100
117280333515380,Hadi For Judge,Husein Hadi For JP4 Campaign,≤100
110468488981853,UNRWA USA,UNRWA USA,≤100
5878048748,GlobalGiving,These ads ran without a disclaimer,≤100
2052968585000306,Kristie Goforth,Friends of Kristie Goforth,≤100
129599883741118,Pennsylvania House Democrats,Robert William Caton,≤100
102690365505154,Guy Ciarrocchi,OUR GUY FOR CONGRESS,≤100
103927497895473,Ben Adams for Idaho,"Ben Adams for Idaho, 1921 Hoover Street, Nampa, Idaho 83686",≤100
711478725532801,Civiqs,Civiqs,≤100
109485984979201,Noah For Judge,The Committee to Elect Noah Lincoln Gambill for Judge,≤100
924238244334607,Nevada School Choice,American Federation for Children,≤100
104332632051575,"Re-Elect Freddie Hayes, Jr.","David Lucas Communication, Inc.",≤100
318196171580489,Ron DeSantis,Friends of Ron DeSantis,≤100
1641748126086296,Avery Frix,FRIX FOR CONGRESS,≤100
112824416194,United Steelworkers,United Steelworkers,≤100
101967858180609,OptOut,OptOut Media Foundation,≤100
542680219237491,Greg Hanley for Plymouth County Commissioner,The Hanley Committee,≤100
105517258700065,Ricky Tsay for State Representative,"Ricky Tsay, Republican, for State Representative, District 119",≤100
30139072158,CARE,CARE,≤100
111381114710035,Luis Cetina,Cetina for Supervisor 2022,≤100
102376312174421,Coalition for Neighborhood Libraries,Coalition for Neighborhood Libraries,≤100
2154447528166011,Animal Wellness Action,Animal Wellness Action,≤100
190845610510,The Alliance: The Voice of Community Nonprofits,CT COMMUNITY NON PROFIT ALLIANCE INC,≤100
101131625108616,Ando,Ando Inc.,≤100
204065282986861,"Black Mountain Home for Children, Youth & Families",These ads ran without a disclaimer,≤100
114008535880,Foundation for Individual Rights in Education,These ads ran without a disclaimer,≤100
635182953184120,Randy Price,Randy Price for Alabama Senate District 13,≤100
101943155826045,Bare Naked Native,Alicia Jean Hicks,≤100
1392331787732959,Jerrod Weems for School Board,Jerrod Weems for School Board,≤100
105437600859954,San Fernando Community Health Center,SAN FERNANDO HOSPITAL,≤100
100427119232126,Travis M. Thul for MiEnergy Board of Directors - District 5,Travis Michael Thul,≤100
109912644985746,Tracy Cramer,Friends of Tracy Cramer,≤100
1417049691858293,Judge Chris Morales,The Chris Morales Campaign,≤100
100990065903668,Cranberry Point Energy Storage,Cranberry Point Energy Storage,≤100
199341990950,DePelchin Children's Center,These ads ran without a disclaimer,≤100
102955695022528,Get Maine Climate Right,Get Maine Climate Right,≤100
723694947709649,Tom Patti County Supervisor,Tom Patti for Supervisor 2020,≤100
107353128535965,Debbie Helsley for Knox County Mayor,The Committee to Elect Debbie Helsley,≤100
155306814545995,"Colorado Latino Leadership, Advocacy & Research Organization (CLLARO)",COLORADO LATINO LEADERSHIP ADVOCACY & RESEARCH ORGANIZATION,≤100
107553188401159,Brandon Gill,The Boswell Project,≤100
102771262126107,Daniel Hertzberg for State Senate,Daniel Hertzberg for Senate 2022,≤100
195275985287,Delaware County Democratic Party - Ohio,Delaware County Democratic Party,≤100
103307545365657,Preserve Hahira's Rural Living Public page,Scott Brinson Turner,≤100
1011655348883612,Greater Coachella Valley Chamber of Commerce,GREATER CV CHAMBER,≤100
104814001464818,Maxed Out Solar,Maxed Out Solar,≤100
107353215106785,Andrew McCarthy for Congress,Matthew Thoms Abruzzo,≤100
104277518897085,RAJAN For Dakota Electric Board 2022,Raj Rajan,≤100
113918325306109,Dallas Holocaust and Human Rights Museum,DALLAS HOLOCAUST AND HUMAN RIGHTS MUSEUM,≤100
182200225145953,Damon Connolly,Damon Connolly for Assembly 2022,≤100
106504598410151,Steve Snodgrass for North Monterey County Supervisor,Snodgrass for Supervisor,≤100
140219922694639,Pacoima Beautiful,PACOIMA BEAUTIFUL,≤100
113255667937305,Labarron Perkins for Mobile County Sheriff,Labarron Tyrick Perkins,≤100
206628262752838,Clayton,CLAYTON HOMES INC,≤100
109746434912677,"Oleg, a Ukrainian blogger and activist",These ads ran without a disclaimer,≤100
112896342076936,Blue Grass Community Foundation,BLUE GRASS COMMUNITY FOUNDATION,≤100
100560691319046,Breeden for IL,Citizens to Elect Travis Breeden,≤100
139398939438430,Left Action,Left Action LLC,≤100
104174611217793,Anne Allen Westbrook,Campaign to Elect Anne Allen Westbrook,≤100
105240455446155,Benda for Congress,BENDA FOR CONGRESS,≤100
105227434941203,Jason Paletta for CA Assembly,Jason Paletta for CA Secretary of State,≤100
112438197095157,"Pete Heuer for Madison County Council, District 3",Committee to Elect Pete Heuer,≤100
101008729217397,Bob Duncan for Georgia State Representative,Friends of Bob Duncan,≤100
1793552290967467,Housing Equality Center of Pennsylvania,Housing Equality Center of Pennsylvania,≤100
270234944821619,Voto En El Extranjero Costa Rica,Peter Philip Lopresti,≤100
183252631711692,Mark Alford,Mark Alford for Congress,≤100
440574966102216,Suffolk PBA,Suffolk County Police Benevolent Association,≤100
43426724597,Paper Culture,Paper Culture LLC,≤100
100416555891522,Babb for Judge,Friends to Elect Khadija Babb For Judge,≤100
105272342149043,Let's Go Brandon - Brandon Spencer State Representative 95th,Brandon Spencer,≤100
111275414736919,Citizens for Luis Arroyo Jr.,Citizens For Luis Arroyo Jr.,≤100
109871338355804,Roscoe Streyle For House District 3,STREYLE FOR HOUSE,≤100
114576283579519,Blue Tent,Blue Tent,≤100
1680905278612998,"Elect Doug Shanks Constable, Seat A, District 5",Douglas Anthony Shanks,≤100
100107395874461,Steve Schultz,Citizens for Steve Schultz,≤100
103517455656081,John Hawk for Imperial County Supervisor District 5,John Hawk for County Supervisor District 5,≤100
119140979493969,Trish DeBerry for Bexar County Judge,Patricia DeBerry Campaign,≤100
101749805785543,John Culpepper for Athens,Committee to Elect John Culpepper,≤100
106212271620992,Altruisa,Altruisa Inc.,≤100
104858822139626,Jamie Lolland,Social Security Updates,≤100
1118500958164482,Rodney Miller for WV,Rodney Miller for WV House,≤100
6787988478,Physicians for Human Rights,"PHYSICIANS FOR HUMAN RIGHTS, INC.",≤100
102764145618831,Colin Flanagan for Ohio State House,Friends of Colin Flanagan,≤100
105074712086023,Robert Boris for State Representative,Robert Boris for State Representative,≤100
389643291372646,Jason Critchlow for Trustee,Elect Jason Critchlow,≤100
114547964474832,"Seriously, Scott?",Scott McMurrain,≤100
103220715648527,Elect Justin Nicklas for Garland County Coroner,Amber Michelle Hogg,≤100
112406526796832,Broad + Liberty,Broad and Liberty Inc,≤100
2406466526306020,James H. Pressly,James Hendrick Pressly,≤100
1058947064227277,10X Growth Conference,These ads ran without a disclaimer,≤100
538263413005405,State Representative Avery Bourne,Irvin for Illinois,≤100
102044408391498,Insure Our Future,Windward Fund,≤100
1888806214722917,Erie County Anti-Stigma Coalition,Erie County Anti-Stigma Coalition,≤100
140114664993,Planned Parenthood of Southern New England,Planned Parenthood of Southern New England,≤100
1796561247240699,Onin Staffing,These ads ran without a disclaimer,≤100
176889585684668,State Senator Sue Rezin,Sue Rezin,≤100
6580173137,Alan Grayson,COMMITTEE TO ELECT ALAN GRAYSON,≤100
103103872271111,James for GISD,JamesforGISD,≤100
103916065450179,J.C. Moore,Friends of Moore for Tosa Judge,≤100
1427957833907159,Millennial Money Management LLC,Millennial Money Management LLC,≤100
107539628535489,Doug Thomas for Craighead County Sheriff,The Committee to Elect Doug Thomas Craighead County Sheriff,≤100
103954836330272,Point Pleasant Beach Politics,John Anthony Fernicola,≤100
354383097917053,Southern First Bank,These ads ran without a disclaimer,≤100
111771218068491,Allan S. Carver for Siskiyou County Superintendent of  Schools,Carver for Superintendent of Schools 2022,≤100
108467738470151,Pirrone for Michigan State Representative,Committee to Elect Paul Pirrone,≤100
107398348528762,Richard Morris for Sumner County Road Superintendent  2022,Richard Wayne Morris,≤100
105812542104705,Ricardo Lara’s Corruption is Making Headlines,Marc Levine for Insurance Commissioner 2022,≤100
476255265061,DuPage County Republicans,DuPage County Republican Central Committee,≤100
105370775220703,Making Florida Better PC,Making Florida Better,≤100
163202650462603,Doug LaMalfa,DOUG LAMALFA COMMITTEE,≤100
525588400930790,Casas en Colorado con Norma Morales,These ads ran without a disclaimer,≤100
112156248863575,"CAI CLAC, California Legislative Action Committee",Community Associations Institute,≤100
100440371438615,Councilman Chris Faraldi,Faraldi for Lynchburg,≤100
429881530453417,"Jefferson County Farmers & Neighbors, Inc. - JFAN","Jefferson County Farmers & Neighbors, Inc.",≤100
1782607892044953,Phillip Ensler for Alabama House District 74,The Committee to Elect Phillip Ensler,≤100
452268584980351,Dr. Sami Al-Abdrabbuh,Sami for Congress,≤100
138014020274830,Tina Certain for School Board,Tina Certain for Alachua County School Board District 1,≤100
101099539264547,Peach State Briefing,Democratic Party of Georgia,≤100
1723654234563693,Joe Patterson,Joe Patterson for Assembly 2022,≤100
103376765658735,Brent Jacobson for State Senate,Friends of Brent Jacobson,≤100
370637476310999,Fullersburg Historic Foundation,These ads ran without a disclaimer,≤100
195047610583003,Ehem. MEP Josef Weidenholzer,These ads ran without a disclaimer,≤100
159624224056415,Cary Institute of Ecosystem Studies,"CARY INSTITUTE OF ECOSYSTEM STUDIES, INC.",≤100
156597671660351,Bill Farmer Jr,"Bill Farmer, Jr. - Council At-Large",≤100
462609750743269,Garden State Initiative,"Garden State Initiative, Inc.",≤100
524399207959953,Truth & Liberty Coalition,Truth & Liberty Coalition,≤100
102986878973358,"Bill Byrd for School Board, District 5",FRIENDS OF BILL BYRD,≤100
103325255648257,Ben Edwards for Whitesboro City Council,Benjamin Layne Edwards,≤100
267590003595370,FAIRx,Floridians for Attainable Rx,≤100
107190978632447,Stacey Caplener for State Representative,Stacey Caplener for State Representative,≤100
98139003684,The Zekelman Holocaust Center,These ads ran without a disclaimer,≤100
58736997707,Marco Rubio,NRSC,≤100
171324356990103,Ads-Up Refugee Network USA,Ads-Up Refugee Network,≤100
145051852759276,Randy Burton for Sheriff of Pender County,William Randy Burton,≤100
107721584799633,Elect Judge Diana López,Friends of Diana Lopez,≤100
80379486838,Snipes USA,These ads ran without a disclaimer,≤100
48157601037,Invisible People,"INVISIBLE PEOPLE, A CALIFORNIA NONPROFIT CORPORATION",≤100
497348647140658,Point Source Youth,Point Source Youth,≤100
171220926269306,Yes for Beaverton Schools,Yes for Beaverton Schools,≤100
1502155529838893,CDA Performance Construction,These ads ran without a disclaimer,≤100
173470656019870,The Daily Yonder,CENTER FOR RURAL STRATEGIES,≤100
1766843683424113,ToledoVotes,Toledo Votes,≤100
103670125559987,Jeremy Kern for Artesia City Council,Red Rocket Media,≤100
107520458504487,"Ruben J. Saldaña for Mercedes City Commissioner, Place 4",Luis Hector Saldaña,≤100
107583875223653,Gisela Villarreal for EMCID Position 7,Gisela Villarreal,≤100
101810652152706,Ship It Zero,These ads ran without a disclaimer,≤100
108809528239922,Luis Pozzolo for Congress,Luis Bernardo Pozzolo,≤100
99490682474,Americans for Prosperity - Colorado,AMERICANS FOR PROSPERITY,≤100
72931140459,Center for Biological Diversity,"CENTER FOR BIOLOGICAL DIVERSITY, INC.",≤100
1759977540905526,Vote Kim Coco,Friends of Kim Coco,≤100
21898300328,BuzzFeed,These ads ran without a disclaimer,≤100
111726193712480,Real Reform Louisiana,Real Reform Louisiana,≤100
102326269134643,Yes on H - Davis,Yes on Measure H,≤100
55708608675,RAND Corporation,"RAND CORPORATION, THE",≤100
2259275250950929,Arlene Chin for Tempe,Arlene Chin for Tempe,≤100
122110757854230,Wake County Libertarian Party,Libertarian Party of Wake County,≤100
106900071958995,Eva Michelle Criswell for Stewart County Clerk,Eva Michelle Criswell,≤100
211565309430701,ToneyforHouse,Toney for House,≤100
123628342904,Michael A. Fenton,Michael A Fenton,≤100
211612232224054,Montgomery County Republican Party,Montgomery County Republican Party,≤100
102257485557967,Broadhurst for Chairman - Marshall County Commission,Broadhurst for Chairman,≤100
